,Unnamed: 0,sample,sent_id,sentences,label
0,0,politifact12773,politifact12773_0,"Speaking in Cleveland, Ohio, Democratic presidential candidate Hillary Clinton called for unity in the wake of the tragic shooting in Orlando.",true_
1,1,politifact12773,politifact12773_1,Here are key moments from that speech.,true_
2,2,politifact12773,politifact12773_2,"(Reuters/Associated Press)Hillary Clinton delivered an address pledging that as president she would take on ""lone wolves"" who might carry out terrorist attacks in the United States and calling for unity in light of the massacre at a gay nightclub in Orlando on Sunday.",true_
3,3,politifact12773,politifact12773_3,"The compete transcript of her remarks in Cleveland are posted below.SPEAKER: FORMER SECRETARY OF STATE HILLARY RODHAM CLINTON, DEMOCRATIC PRESIDENTIAL CANDIDATECLINTON: Thank you.",true_
4,4,politifact12773,politifact12773_4,(APPLAUSE)Thank you all very much.,true_
5,5,politifact12773,politifact12773_5,(APPLAUSE)Thank you.,true_
9,9,politifact12773,politifact12773_9,I am -- I'm absolutely -- I'm absolutely delighted to be back in Cleveland and to be here at the Industrial Innovation Center.,true_
10,10,politifact12773,politifact12773_10,I've had a chance to learn about the great work you do here.,true_
11,11,politifact12773,politifact12773_11,"I especially want to applaud Team Wendy for everything you do to protect our troops, first responders.",true_
12,12,politifact12773,politifact12773_12,(APPLAUSE)And others from traumatic brain injury.,true_
13,13,politifact12773,politifact12773_13,It is so important that we continue to support those who protect us.AUDIENCE: We want Hillary!CLINTON: Thank you.AUDIENCE: We want Hillary!CLINTON: Thank you all.AUDIENCE: We want Hillary!,true_
14,14,politifact12773,politifact12773_14,"(APPLAUSE)CLINTON: It is good to be back in Cleveland, I can tell you that.",true_
15,15,politifact12773,politifact12773_15,"(APPLAUSE)I want to thank -- I wan to thank your extraordinary senator, Sherrod Brown, for his leadership, for that very kind and generous introduction.",true_
16,16,politifact12773,politifact12773_16,You are very fortunate to -- to have him representing you.,true_
17,17,politifact12773,politifact12773_17,"I want to thank your congresswoman, Marcia Fudge...(APPLAUSE)Who is both indomitable and indefatigable.",true_
18,18,politifact12773,politifact12773_18,She is such a tenacious advocate for the people she represents.,true_
19,19,politifact12773,politifact12773_19,"I want to acknowledge the mayor, Mayor Jackson, who was here, County Executive Budish (ph).",true_
20,20,politifact12773,politifact12773_20,"And I particularly want to recognize the passing of George Voinovich, and he devoted his life to serving the people of Ohio as mayor of Cleveland, as governor and senator.",true_
21,21,politifact12773,politifact12773_21,"And we send our prayers and sympathy to his family.I also want to thank Dan Moore, the owner and founder of this company and Team Wendy for his belief in Cleveland, for his commitment to create jobs.",true_
22,22,politifact12773,politifact12773_22,I can't wait to work with him to do more of what he has accomplished here.,true_
23,23,politifact12773,politifact12773_23,"(APPLAUSE)You know, originally, I had intended to come to Cleveland under very different circumstances.",true_
24,24,politifact12773,politifact12773_24,We are heading into a general election that could be the most consequential of our lifetimes.,true_
25,25,politifact12773,politifact12773_25,"But today is not a day for politics.On Sunday, Americans woke up to a nightmare that's become mind numbingly familiar.",true_
26,26,politifact12773,politifact12773_26,Another act of terrorism in a place no one expected.,true_
27,27,politifact12773,politifact12773_27,"A madman filled with hate, with guns in his hands, and just a horrible sense of vengeance and vindictiveness in his heart, apparently consumed by rage against LGBT Americans, and by extension, the openness and diversity that defines our American way of life.We will learn more about the killer in the days to come.",true_
28,28,politifact12773,politifact12773_28,"We know that he pledged allegiance to ISIS, that they are now taking credit and that part of their strategy is to radicalize individuals and encourage attacks against the United States, even if they are not coordinated with ISIS leadership.",true_
29,29,politifact12773,politifact12773_29,"But there's a lot we still don't know, including what other mix of motives drove him to kill.The more we learn about what happened, the better we'll be able to protect our people going forward.",true_
30,30,politifact12773,politifact12773_30,"In the days ahead, we will also learn more about the many lives he viciously cut short, many of them young people, just starting out in their lives.",true_
31,31,politifact12773,politifact12773_31,"They were travel agents and pharmacy techs, college students and amusement park workers, sons and daughters, brothers and sisters, and they had one thing in common.",true_
32,32,politifact12773,politifact12773_32,"They all had a lot more to give.CLINTON: We should take a moment today amid our busy lives to think about them, to pray for everyone who was killed, for the wounded, those who are fighting to regain their lives and futures, for our first responders who walked into danger one more time.",true_
33,33,politifact12773,politifact12773_33,"As a mother, I can't imagine what those families are going through.But let's also remember the other scenes we saw on Sunday.",true_
34,34,politifact12773,politifact12773_34,We saw the faces of some of those first responders who rushed into danger and tried to save as many people as they could.,true_
35,35,politifact12773,politifact12773_35,"We saw survivors like Chris Hansen who risked their lives to help others.People gathering outside hospitals to comfort anxious family members, waiting for news of their loved ones and waiting, too, to learn more about what they could do to make sure this never happened again.Religion leaders condemning hate and appealing for peace.",true_
36,36,politifact12773,politifact12773_36,People lining up to donate blood.,true_
37,37,politifact12773,politifact12773_37,Americans refusing to be intimidated or divided.Yesterday I called Mayor Dyer of Orlando and offered my support and my appreciation for the leadership that he and the other officials have shown.,true_
38,38,politifact12773,politifact12773_38,"This is a moment when all Americans need to stand together.No matter how many times we endure attacks like this, the horror never fades.",true_
39,39,politifact12773,politifact12773_39,"The murder of innocent people breaks our hearts, tears at our sense of security and makes us furious.Now we have to steal our resolve to respond.",true_
40,40,politifact12773,politifact12773_40,And that's what I want to talk to you about.,true_
41,41,politifact12773,politifact12773_41,"How we respond.The Orlando terrorist may be dead, but the virus that poisoned his mind remains very much alive.",true_
42,42,politifact12773,politifact12773_42,"And we must attack it with clear eyes, steady hands, unwavering determination and pride in our country and our values.",true_
43,43,politifact12773,politifact12773_43,(APPLAUSE)I have no doubt -- I have no doubt we can meet this challenge if we meet it together.,true_
44,44,politifact12773,politifact12773_44,"Whatever we learn about this killer, his motives in the days ahead, we know already the barbarity that we face from radical jihadists is profound.In the Middle East, ISIS is attempting a genocide of religious and ethnic minorities.",true_
45,45,politifact12773,politifact12773_45,They are slaughtering Muslims who refuse to accept their medieval ways.,true_
46,46,politifact12773,politifact12773_46,"They are beheading civilians, including executing LGBT people.",true_
47,47,politifact12773,politifact12773_47,"They are murdering Americans and Europeans, enslaving, torturing and raping women and girls.In speeches like this one, after Paris, Brussels and San Bernardino, I have laid out a plan to defeat ISIS and the other radical jihadist groups in the region and beyond.The attack in Orlando makes it even more clear, we cannot contain this threat.",true_
48,48,politifact12773,politifact12773_48,We must defeat it.,true_
49,49,politifact12773,politifact12773_49,"And the good news is that the coalition effort in Syria and Iraq has made recent gains in the last months.So we should keep the pressure on ramping up the air campaign, accelerating support for our friends fighting to take and hold ground and pushing our partners in the region to do even more.We also need continued American leadership to help resolve the political conflicts that fuel ISIS recruitment efforts.But as ISIS loses actual ground in Iraq and Syria, it will seek to stage more attacks and gain stronger footholds wherever it can, from Afghanistan, to Libya, to Europe.The threat is metastasizing.",true_
50,50,politifact12773,politifact12773_50,We saw this in Paris.,true_
51,51,politifact12773,politifact12773_51,And we saw it in Brussels.,true_
52,52,politifact12773,politifact12773_52,"We face a twisted ideology and poisoned psychology that inspires the so-called lone wolves, radicalized individuals who may or may not have contact and direction from any formal organization.CLINTON: So, yes, efforts to defeat ISIS on the battlefield must succeed.",true_
53,53,politifact12773,politifact12773_53,But it will take more than that.,true_
54,54,politifact12773,politifact12773_54,(APPLAUSE)We have to be just as adaptable and versatile as our enemies.,true_
55,55,politifact12773,politifact12773_55,"As president, I will make identifying and stopping lone wolves a top priority.",true_
56,56,politifact12773,politifact12773_56,"(APPLAUSE)I will put a team together from across our government, the entire government, as well as the private sector and communities to get on top of this urgent challenge.",true_
57,57,politifact12773,politifact12773_57,"And I will make sure our law enforcement and intelligence professionals have all the resources they need to get the job done.As we do this, there are three areas that demand attention.",true_
58,58,politifact12773,politifact12773_58,"First, we and our allies must work hand-in-hand to dismantle the networks that move money, and propaganda, and arms and fighters around the world.",true_
59,59,politifact12773,politifact12773_59,"(APPLAUSE)We have to flow -- we have to stem the flow of jihadists from Europe and Iraq, Syria, Afghanistan and then back again.",true_
60,60,politifact12773,politifact12773_60,"The only way to do this is by working closely with our partners, strengthening our alliances, not weakening them or walking away from them.Second, here at home, we must harden our own defenses.",true_
61,61,politifact12773,politifact12773_61,"We have to do more to support our first responders, law enforcement and intelligence officers who do incredible work every day at great personal risk to keep our country safe.",true_
62,62,politifact12773,politifact12773_62,"(APPLAUSE)I have seen firsthand how hard their job is, and how well they do it.In Orlando, at least one police officer was shot in the head.",true_
63,63,politifact12773,politifact12773_63,"Thankfully, his life was saved by a Kevlar helmet, something folks here at Team Wendy know a lot about.",true_
64,64,politifact12773,politifact12773_64,"(APPLAUSE)It has often been said that our law enforcement, our intelligence agencies, our first responders have to be right 100 percent of the time, but terrorists only have to be right once.What a heavy responsibility.",true_
65,65,politifact12773,politifact12773_65,These men and women deserve both our respect and gratitude.,true_
66,66,politifact12773,politifact12773_66,"And they deserve the right tools, and resources and training.",true_
67,67,politifact12773,politifact12773_67,"Too often, state and local officials can't get access to intelligence from the federal government that would help them do their jobs.We need to change that.",true_
68,68,politifact12773,politifact12773_68,"We also need to work...(APPLAUSE)We also need to work with local law enforcement and business owners on ways to protect vulnerable, so-called soft targets, like nightclubs and shopping malls and hotels and movie theaters and schools and houses of worship.Now, I know a lot of Americans are asking how it was possible that someone already on the FBI's radar could have still been able to commit an attack like the one in Orlando, and what more we can do to stop this kind of thing from happening again.Well, we have to see what the investigation uncovers.",true_
69,69,politifact12773,politifact12773_69,"If there are things that can and should be done to improve our ability to prevent, we must do them.",true_
70,70,politifact12773,politifact12773_70,We already know we need more resources for this fight.,true_
71,71,politifact12773,politifact12773_71,"The professionals who keep us safe would be the first to say we need better intelligence to discover and disrupt terrorist plots before they can be carried out.That's why I have proposed an intelligence surge to bolster our capabilities across the board with appropriate safeguards here at home.Even as we make sure our security officials get the tools they need to prevent attacks, it's essential that we stop terrorists from getting the tools they need to carry out the attack.",true_
72,72,politifact12773,politifact12773_72,(APPLAUSE)CLINTON: And that is especially true when it comes to assault weapons like those used in Orlando and San Bernardino.,true_
73,73,politifact12773,politifact12773_73,"(APPLAUSE)I believe weapons of war have no place on our streets and we may have our disagreements about gun safety regulations, but we should all be able to agree on a few essential things.If the FBI is watching you for a suspected terrorist link, you shouldn't be able to just go buy a gun with no questions asked.And you shouldn't be able to exploit loopholes and evade criminal background checks by buying online or at a gun show.And yes, if you're too dangerous to get on a plane, you are too dangerous to buy a gun in America.Now, I know some will say that assault weapons and background checks are totally separate issues having nothing to do with terrorism.",true_
74,74,politifact12773,politifact12773_74,"Well, in Orlando and San Bernardino terrorists used assault weapons, the AR-15.",true_
75,75,politifact12773,politifact12773_75,And they used it to kill Americans.,true_
76,76,politifact12773,politifact12773_76,That was the same assault weapon used to kill those little children in Sandy Hook.We have to make it harder for people who should not have those weapons of war.,true_
77,77,politifact12773,politifact12773_77,"And that may not stop every shooting or every terrorist attack, but it will stop some and it will save lives and it will protect our first responders.And I want you to know, I'm not going to stop fighting for these kinds of provisions.Now, the third area that demands attention is preventing radicalization and countering efforts by ISIS and other international terrorist networks to recruit in the United States and Europe.For starters, it is long past time for the Saudis, the Qataris and the Kuwaitis and others to stop their citizens from funding extremist organizations.",true_
78,78,politifact12773,politifact12773_78,And they should stop supporting radical schools and mosques around the world that have set too many young people on a path towards extremism.We also have to use all our capabilities to counter jihadist propaganda online.,true_
79,79,politifact12773,politifact12773_79,"This is something that I spend a lot of time on at the State Department.As president, I will work with our great tech companies from Silicon Valley to Boston to step up our game.",true_
80,80,politifact12773,politifact12773_80,"We have to a better job intercepting ISIS' communications, tracking and analyzing social media posts and mapping jihadist networks, as well as promoting credible voices who can provide alternatives to radicalization.And there is more to do offline as well.CLINTON: Since 9/11, law enforcement agencies have worked hard to build relationships with Muslim American communities.",true_
81,81,politifact12773,politifact12773_81,"Millions of peace-loving Muslims live, work and raise their families across America.",true_
82,82,politifact12773,politifact12773_82,"And they are the most likely to recognize the insidious effects of radicalization before it's too late, and the best positioned to help us block it.",true_
83,83,politifact12773,politifact12773_83,"So we should be intensifying contacts in those communities, not scapegoating or isolating them.",true_
84,84,politifact12773,politifact12773_84,"(APPLAUSE)Last year, I visited a pilot program in Minneapolis that helps parents, teachers, imams, mental health professionals and others recognize signs of radicalization in young people and work with law enforcement to intervene before it's too late.I've also met with local leaders pursuing innovative approaches in Los Angeles and other places.",true_
85,85,politifact12773,politifact12773_85,And we need more efforts like that in more cities across America.,true_
86,86,politifact12773,politifact12773_86,"And as the director of the FBI has pointed out, we should avoid eroding trust in that community, which will only make law enforcement's job more difficult.Inflammatory anti-Muslim rhetoric and threatening to ban the families and friends of Muslim Americans as well as millions of Muslim business people and tourists from entering our country hurts the vast majority of Muslims who love freedom and hate terror.",true_
87,87,politifact12773,politifact12773_87,(APPLAUSE)So does saying that we have to start special surveillance on our fellow Americans because of their religion.,true_
88,88,politifact12773,politifact12773_88,It's no coincidence that hate crimes against American Muslims and mosques have tripled after Paris and San Bernardino.,true_
89,89,politifact12773,politifact12773_89,That's wrong.,true_
90,90,politifact12773,politifact12773_90,And it's also dangerous.,true_
91,91,politifact12773,politifact12773_91,"It plays right into the terrorists' hands.Still, as I have said before, none of us can close our eyes to the fact that we do face enemies who use their distorted version of Islam to justify slaughtering $ innocent people.",true_
92,92,politifact12773,politifact12773_92,"They'd take us all back to the Stone Age if they could, just as they have in parts of Iraq and Syria.The terrorist in Orlando targeted LGBT Americans out of hatred and bigotry.",true_
93,93,politifact12773,politifact12773_93,And an attack on any American is an attack on all Americans.,true_
94,94,politifact12773,politifact12773_94,(APPLAUSE) And I want to say this to all the LGBT people grieving today in Florida and across our country.,true_
95,95,politifact12773,politifact12773_95,You have millions of allies who will always have your back.,true_
96,96,politifact12773,politifact12773_96,(APPLAUSE)And I am one of them.,true_
97,97,politifact12773,politifact12773_97,"(APPLAUSE)From Stonewall to Laramie, and now Orlando, we've seen too many examples of how the struggle to live freely, openly and without fear has been met by violence.",true_
98,98,politifact12773,politifact12773_98,"We have to stand together, be proud together.",true_
99,99,politifact12773,politifact12773_99,"There is no better rebuke to the terrorists and all those who hate.Our open, diverse society is an asset in the struggle against terrorism, not a liability.",true_
100,100,politifact12773,politifact12773_100,It makes us stronger and more resistant to radicalization.,true_
101,101,politifact12773,politifact12773_101,And this raises a larger point about the future of our country.America is strongest when we all believe that we have a stake in our country and our future.CLINTON: This vision has sustained us from the beginning.,true_
102,102,politifact12773,politifact12773_102,"The belief that, yes, we are all created equal and the journey we have made to turn that into reality over the course of our history, that we are not a land of winners and losers, that we should all have the opportunity to live up to our God-given potential.",true_
103,103,politifact12773,politifact12773_103,And we have a responsibility to help others do so as well.,true_
104,104,politifact12773,politifact12773_104,"(APPLAUSE)As I look at American history, I see that this has always been a country of ""we"" not ""me.""",true_
105,105,politifact12773,politifact12773_105,We stand together because we are stronger together.,true_
106,106,politifact12773,politifact12773_106,E pluribus unum.,true_
107,107,politifact12773,politifact12773_107,"One -- out of many, one -- has seen us through the darkest chapters of our history.",true_
108,108,politifact12773,politifact12773_108,"Ever since 13 squabbling colonies put aside their disagreements and united because they realized they were going to rise together or fall separately, generation after generation has fought and marched and organized to widen the circle of dignity and opportunity.",true_
109,109,politifact12773,politifact12773_109,Ending slavery.,true_
110,110,politifact12773,politifact12773_110,Securing and expanding the right to vote.,true_
111,111,politifact12773,politifact12773_111,Throwing open the doors of education.,true_
112,112,politifact12773,politifact12773_112,Building the greatest middle class the world has ever seen.And we are stronger when more people can participate in our democracy.,true_
113,113,politifact12773,politifact12773_113,"(APPLAUSE)And we are stronger when everyone can share in the rewards of our economy and contribute to our communities, when we bridge our divides and lift each other up instead of tearing each other down.",true_
114,114,politifact12773,politifact12773_114,Now we have overcome a lot together and we will overcome the threats of terror and radicalization and all of our other challenges.,true_
115,115,politifact12773,politifact12773_115,"Here in Ohio and across America, I've listened to people talk about the problems that keep you up at night.The bonds that hold us together as communities, as one national community, are strained by an economy with too much inequality and too little upward mobility.",true_
116,116,politifact12773,politifact12773_116,By social and political divisions that have diminished our trust in each other and our confidence in our shared future.,true_
117,117,politifact12773,politifact12773_117,"I have heard that, and I want you to know as your president I will work every day to break down all the barriers holding you back and keeping us apart.",true_
118,118,politifact12773,politifact12773_118,"We're gonna get an economy that works for everyone, not just those at the top, we're gonna forge a new sense of connection and shared responsibility to each other and our nation.And finally,(APPLAUSE) finally let me remind us all, I remember, I remember how it felt, on the day after 9/11, and I bet many of you do as well.",true_
119,119,politifact12773,politifact12773_119,Americans from all walks of life rallied together with a sense of common purpose on September the 12th and in the days and weeks and months that followed.,true_
120,120,politifact12773,politifact12773_120,We had each others' backs.,true_
121,121,politifact12773,politifact12773_121,I was a senator from New York.,true_
122,122,politifact12773,politifact12773_122,"There was a Republican president, a Republican governor, and a Republican mayor.",true_
123,123,politifact12773,politifact12773_123,We did not attack each other.,true_
124,124,politifact12773,politifact12773_124,We worked with each other to protect our country and to rebuild our city (ph).,true_
125,125,politifact12773,politifact12773_125,(APPLAUSE)President Bush went to a Muslim community center just six days after the attacks to send a message of unity and solidarity.,true_
126,126,politifact12773,politifact12773_126,"To anyone who wanted to take out their anger on our Muslim neighbors and fellow citizens, he said, ""That should not, and that will not, stand in America.""",true_
127,127,politifact12773,politifact12773_127,"It is time to get back to the spirit of those days, spirit of 9/12.",true_
128,128,politifact12773,politifact12773_128,"Let's make sure we keep looking to the best of our country, to the best within each of us.",true_
129,129,politifact12773,politifact12773_129,Democratic and Republican presidents have risen to the occasion in the face of tragedy.,true_
130,130,politifact12773,politifact12773_130,That is what we are called to do my friends and I am so confident and optimistic that is exactly what we will do.Thank you all so much.,true_
6,6,politifact12773,politifact12773_6,Thank you all.,noise
7,7,politifact12773,politifact12773_7,(APPLAUSE)Thank you.,noise
8,8,politifact12773,politifact12773_8,Thank you.,noise
