,Unnamed: 0,sample,sent_id,sentences,label
144,144,politifact390,politifact390_144,"If we don't, then we're going to continue to see the kind of deterioration that we've seen economically here in this state.MR.",true_
145,145,politifact390,politifact390_145,"RUSSERT: I want to ask you both about NAFTA because the record, I think, is clear.",true_
146,146,politifact390,politifact390_146,And I want to -- Senator Clinton.,true_
147,147,politifact390,politifact390_147,Senator Obama said that you did say in 2004 that on balance NAFTA has been good for New York and America.,true_
148,148,politifact390,politifact390_148,You did say that.,true_
149,149,politifact390,politifact390_149,"When President Clinton signed this bill -- and this was after he negotiated two new side agreements, for labor and environment -- President Clinton said it would be a force for economic growth and social progress.",true_
150,150,politifact390,politifact390_150,You said in '96 it was proving its worth as free and fair trade.,true_
151,151,politifact390,politifact390_151,You said that -- in 2000 -- it was a good idea that took political courage.,true_
152,152,politifact390,politifact390_152,"So your record is pretty clear.Based on that, and which you're now expressing your discomfort with it, in the debate that Al Gore had with Ross Perot, Al Gore said the following: ""If you don't like NAFTA and what it's done, we can get out of it in six months.The president can say to Canada and Mexico, we are out.",true_
153,153,politifact390,politifact390_153,"This has not been a good agreement.""",true_
154,154,politifact390,politifact390_154,Will U.S. president say we are out of NAFTA in six months?SEN.,true_
155,155,politifact390,politifact390_155,"CLINTON: I have said that I will renegotiate NAFTA, so obviously, you'd have to say to Canada and Mexico that that's exactly what we're going to do.",true_
156,156,politifact390,politifact390_156,"But you know, in fairness --MR. RUSSERT: Just because -- maybe Clinton --SEN. CLINTON: Yes, I am serious.MR.",true_
157,157,politifact390,politifact390_157,RUSSERT: You will get out.,true_
158,158,politifact390,politifact390_158,"You will notify Mexico and Canada, NAFTA is gone in six months.Advertisement Continue reading the main storySEN.",true_
159,159,politifact390,politifact390_159,"CLINTON: No, I will say we will opt out of NAFTA unless we renegotiate it, and we renegotiate on terms that are favorable to all of America.But let's be fair here, Tim.",true_
160,160,politifact390,politifact390_160,"There are lots of parts of New York that have benefitted, just like there are lots of parts of Texas that have benefitted.",true_
161,161,politifact390,politifact390_161,"The problem is in places like upstate New York, places like Youngstown, Toledo, and others throughout Ohio that have not benefitted.",true_
162,162,politifact390,politifact390_162,"And if you look at what I have been saying, it has been consistent.You know, Senator Obama told the farmers of Illinois a couple of years ago that he wanted more trade agreements.",true_
163,163,politifact390,politifact390_163,"I -- right now --MR. RUSSERT: We're going to get -- we're going to get to Senator Obama, but I want to stay on your terms --SEN. CLINTON: Well, but that -- but that is important --MR. RUSSERT: -- because this was something that you wrote about as a real success for your husband.",true_
164,164,politifact390,politifact390_164,"You said it was good on balance for New York and America in 2004, and now you're in Ohio and your words are much different, Senator.",true_
165,165,politifact390,politifact390_165,The record is very clear.SEN.,true_
166,166,politifact390,politifact390_166,"CLINTON: Well, I -- I -- you don't have all the record because you can go back and look at what I've said consistently.",true_
167,167,politifact390,politifact390_167,"And I haven't just said things; I have actually voted to toughen trade agreements, to try to put more teeth into our enforcement mechanisms.",true_
168,168,politifact390,politifact390_168,"And I will continue to do so.But you know, Tim, when you look at what the Cleveland Plain Dealer said when they examined the kind of criticism that Senator Obama was making of me -- it's not me saying it -- they said it was erroneous.",true_
169,169,politifact390,politifact390_169,"And it was erroneous because it didn't look at the entire picture, both at what I've said and what I've done.But let's talk about what we're going to do.",true_
170,170,politifact390,politifact390_170,"It is not enough just to criticize NAFTA, which I have, and for some years now.",true_
171,171,politifact390,politifact390_171,"I have put forward a very specific plan about what I would do, and it does include telling Canada and Mexico that we will opt out unless we renegotiate the core labor and environmental standards -- not side agreements, but core agreements; that we will enhance the enforcement mechanism; and that we will have a very clear view of how we're going to review NAFTA going forward to make sure it works, and we're going to take out the ability of foreign companies to sue us because of what we do to protect our workers.Advertisement Continue reading the main storyI would also say that you can go back and look at from the very beginning -- I think David Gergen was on TV today remembering that I was very skeptical about it.It has worked in some parts of America.",true_
172,172,politifact390,politifact390_172,It has not worked in Ohio.,true_
173,173,politifact390,politifact390_173,It has not worked in upstate New York.,true_
174,174,politifact390,politifact390_174,And since I've been in the Senate -- neither of us voted on this.,true_
175,175,politifact390,politifact390_175,That wasn't something either of us got to cast an independent vote on.,true_
176,176,politifact390,politifact390_176,"Since I have been in the Senate, I have worked to try to ameliorate the impact of these trade agreements.MR.",true_
177,177,politifact390,politifact390_177,RUSSERT: But let me button this up.,true_
178,178,politifact390,politifact390_178,"Absent the change that you're suggesting, you are willing to opt out of NAFTA in six months?SEN.",true_
179,179,politifact390,politifact390_179,"CLINTON: I'm confident that as president, when I say we will opt out unless we renegotiate, we will be able to renegotiate.MR.",true_
180,180,politifact390,politifact390_180,"RUSSERT: Senator Obama, you did in 2004 talk to farmers and suggest that NAFTA had been helpful.",true_
181,181,politifact390,politifact390_181,"The Associated Press today ran a story about NAFTA, saying that you have been consistently ambivalent towards the issue.",true_
182,182,politifact390,politifact390_182,"Simple question: Will you, as president, say to Canada and Mexico, ""This has not worked for us; we are out""?SEN.",true_
183,183,politifact390,politifact390_183,"OBAMA: I will make sure that we renegotiate, in the same way that Senator Clinton talked about.",true_
184,184,politifact390,politifact390_184,And I think actually Senator Clinton's answer on this one is right.,true_
185,185,politifact390,politifact390_185,I think we should use the hammer of a potential opt-out as leverage to ensure that we actually get labor and environmental standards that are enforced.,true_
186,186,politifact390,politifact390_186,And that is not what has been happening so far.That is something that I have been consistent about.,true_
187,187,politifact390,politifact390_187,"I have to say, Tim, with respect to my position on this, when I ran for the United States Senate, the Chicago Tribune, which was adamantly pro-NAFTA, noted that, in their endorsement of me, they were endorsing me despite my strong opposition to NAFTA.And that conversation that I had with the Farm Bureau, I was not ambivalent at all.",true_
188,188,politifact390,politifact390_188,"What I said was that NAFTA and other trade deals can be beneficial to the United States because I believe every U.S. worker is as productive as any worker around the world, and we can compete with anybody.",true_
189,189,politifact390,politifact390_189,And we can't shy away from globalization.,true_
190,190,politifact390,politifact390_190,We can't draw a moat around us.,true_
191,191,politifact390,politifact390_191,"But what I did say, in that same quote, if you look at it, was that the problem is we've been negotiating just looking at corporate profits and what's good for multinationals, and we haven't been looking at what's good for communities here in Ohio, in my home state of Illinois, and across the country.Advertisement Continue reading the main storyAnd as president, what I want to be is an advocate on behalf of workers.",true_
192,192,politifact390,politifact390_192,"Look, you know, when I go to these plants, I meet people who are proud of their jobs.",true_
193,193,politifact390,politifact390_193,They are proud of the products that they've created.,true_
194,194,politifact390,politifact390_194,They have built brands and profits for their companies.,true_
195,195,politifact390,politifact390_195,"And when they see jobs shipped overseas and suddenly they are left not just without a job, but without health care, without a pension, and are having to look for seven-buck-an-hour jobs at the local fast-food joint, that is devastating on them, but it's also devastating on the community.",true_
196,196,politifact390,politifact390_196,That's not the way that we're going to prosper as we move forward.MR.,true_
197,197,politifact390,politifact390_197,"RUSSERT: Senator, two journalists here in Ohio wrote a piece called ""Business as Usual,"" which is very well known, suggesting it wasn't trade or manufacturing jobs that were being lost because of it, but rather business as usual: lack of patents, lack of innovation, lack of investment, 70 percent of the Ph.D.s in biology, chemistry, engineering leaving the state.The fact is, exports now have the highest share of our national income ever.",true_
198,198,politifact390,politifact390_198,Ohio ranks fourth in terms of exports to Canada and Mexico.,true_
199,199,politifact390,politifact390_199,Are you sure this has not been better for Ohio than you're suggesting?SEN.,true_
200,200,politifact390,politifact390_200,OBAMA: I'm positive it hasn't been better for Ohio.,true_
201,201,politifact390,politifact390_201,"But you are making a very legitimate point, which is, is that this trade (can/can't ?)",true_
202,202,politifact390,politifact390_202,be the only part of our economic agenda.,true_
203,203,politifact390,politifact390_203,"But we've seen seven years in which we have a president who has been looking out for the well-heeled and people who are doing very well in the global economy, in the financial industries, in the telecommunications industries, and has not been looking out for ordinary workers.What do we have to do?",true_
204,204,politifact390,politifact390_204,We're going to have to invest in infrastructure to make sure that we're competitive.,true_
205,205,politifact390,politifact390_205,And I've got a plan to do that.,true_
206,206,politifact390,politifact390_206,We're going to have to invest in science and technology.,true_
207,207,politifact390,politifact390_207,We've got to vastly improve our education system.,true_
208,208,politifact390,politifact390_208,"We have to look at energy and the potential for creating green jobs that can not just save on our energy costs but, more importantly, can create jobs in building windmills that will produce manufacturing jobs here in Ohio, can put rural communities back on their feet by working on alternative fuels, making buildings more energy efficient.We can hire young people who are out of work and put them to work in the trade.",true_
209,209,politifact390,politifact390_209,"So there are all sorts of things that we're going to have to do to make the United States economy much more competitive, and those are plans that I have put forward in this campaign and I expect to pursue as president of the United States of America.MR.",true_
210,210,politifact390,politifact390_210,"RUSSERT: Senator Clinton, on the issue of jobs, I watched you the other day with your economic blueprint in Wisconsin saying, this is my plan; hold me accountable.",true_
211,211,politifact390,politifact390_211,And I've had a chance to read it very carefully.,true_
212,212,politifact390,politifact390_212,"It does say that you pledge to create 5 million new jobs over 10 years.And I was reminded of your campaign in 2000 in Buffalo, my hometown, just three hours down Route 90, where you pledged 200,000 new jobs for upstate New York.",true_
213,213,politifact390,politifact390_213,"There's been a net loss of 30,000 jobs.",true_
214,214,politifact390,politifact390_214,"And when you were asked about your pledge, your commitment, you told The Buffalo News, ""I might have been a little exuberant.""",true_
215,215,politifact390,politifact390_215,Tonight will you say that the pledge of 5 million jobs might be a little exuberant?Advertisement Continue reading the main storySEN.,true_
216,216,politifact390,politifact390_216,"CLINTON: No, Tim, because what happened in 2000 is that I thought Al Gore was going to be president.",true_
217,217,politifact390,politifact390_217,"And when I made the pledge I was counting on having a Democratic White House, a Democratic president who shared my values about what we needed to do to make the economy work for everyone and to create shared prosperity.And as you know, despite the difficulties of the Bush administration and a Republican Congress for six years of my first term I have worked very hard to create jobs but obviously as president I will have a lot more tools at my disposal.",true_
218,218,politifact390,politifact390_218,"And the reason why we can create at least 5 million new jobs -- I mean, this is not a big leap.",true_
219,219,politifact390,politifact390_219,Twenty-two point seven million new jobs were created during the eight years of the Clinton administration under my husband.,true_
220,220,politifact390,politifact390_220,We can create at least 5 million new jobs.I'm not just talking about it.,true_
221,221,politifact390,politifact390_221,I helped to pass legislation to begin a training program for green collar jobs.,true_
222,222,politifact390,politifact390_222,"I want to see people throughout Ohio being trained to do the work that will put solar panels on roofs, install wind turbines, do geothermal, take advantage of biofuels, and I know that if we had put $5 billion into the stimulus package to really invest in the training and the tax incentives that would have created those jobs as the Democrats wanted, as I originally proposed, we would be on the way to creating those.You know, take a country like Germany.",true_
223,223,politifact390,politifact390_223,They made a big bet on solar power.,true_
224,224,politifact390,politifact390_224,"They have a smaller economy and population than ours.They've created several hundred thousand new jobs, and these are jobs that can't be outsourced.",true_
225,225,politifact390,politifact390_225,"These are jobs that have to be done in Youngstown, in Dayton, in Cincinnati.",true_
226,226,politifact390,politifact390_226,"These are jobs that we can create here with the right combination of tax incentives, training, and a commitment to following through.",true_
227,227,politifact390,politifact390_227,So I do think that at least 5 million jobs are fully capable of being produced within the next 10 years.MR.,true_
228,228,politifact390,politifact390_228,RUSSERT: Brian?MR.,true_
229,229,politifact390,politifact390_229,"WILLIAMS: Senator Obama, yesterday Senator Clinton gave a speech on foreign policy and I'm going to read you a quote from it.",true_
230,230,politifact390,politifact390_230,"Quote, ""We've seen the tragic result of having a president who had neither the experience nor the wisdom to manage our foreign policy and safeguard our national security.",true_
231,231,politifact390,politifact390_231,We cannot let that happen again.,true_
232,232,politifact390,politifact390_232,"America has already taken that chance one time too many.""",true_
233,233,politifact390,politifact390_233,Some of the comments in the speech were more pointed.,true_
234,234,politifact390,politifact390_234,The senator has compared your foreign policy expertise to that of George W. Bush at the same period.,true_
235,235,politifact390,politifact390_235,"Provided you could be going into a general election against a Republican with vast foreign policy expertise and credibility on national security, how were her comments about you unfair?SEN.",true_
236,236,politifact390,politifact390_236,"OBAMA: Well, Senator Clinton I think equates experience with longevity in Washington.",true_
237,237,politifact390,politifact390_237,I don't think the American people do and I don't think that if you look at the judgments that we've made over the last several years that that's the accurate measure.,true_
238,238,politifact390,politifact390_238,"On the most important foreign policy decision that we face in a generation -- whether or not to go into Iraq -- I was very clear as to why we should not -- that it would fan the flames of anti-American sentiment -- that it would distract us from Afghanistan -- that it would cost us billions of dollars, thousands of lives, and would not make us more safe, and I do not believe it has made us more safe.Al Qaeda is stronger than anytime since 2001 according to our own intelligence estimates, and we are bogged down in a war that John McCain now suggests might go on for another 100 years, spending $12 billion a month that could be invested in the kinds of programs that both Senator Clinton and I are talking about.",true_
239,239,politifact390,politifact390_239,"So on Pakistan, during the summer I suggested that not only do we have to take a new approach towards Musharraf but we have to get much more serious about hunting down terrorists that are currently in northwestern Pakistan.Advertisement Continue reading the main storyAnd many people said at the time well, you can't target those terrorists because Musharraf is our ally and we don't want to offend him.",true_
240,240,politifact390,politifact390_240,"In fact, what we had was neither stability in Pakistan nor democracy in Pakistan, and had we pursued a policy that was looking at democratic reforms in Pakistan we would be much further along now than we are.",true_
241,241,politifact390,politifact390_241,So on the critical issues that actually matter I believe that my judgment has been sound and it has been judgment that I think has been superior to Senator Clinton's as well as Senator McCain's.MR.,true_
242,242,politifact390,politifact390_242,"WILLIAMS: Well, Senator Clinton, in the last debate you seemed to take a pass on the question of whether or not Senator Obama was qualified to be commander in chief.",true_
243,243,politifact390,politifact390_243,Is your contention in this latest speech that America would somehow be taking a chance on Senator Obama as commander in chief?SEN.,true_
244,244,politifact390,politifact390_244,"CLINTON: Well, I have put forth my extensive experience in foreign policy, you know, helping to support the peace process in Northern Ireland, negotiating to open borders so that refugees fleeing ethnic cleansing would be safe, going to Beijing and standing up for women's rights as human rights and so much else.",true_
245,245,politifact390,politifact390_245,"And every time the question about qualifications and credentials for commander in chief are raised, Senator Obama rightly points to the speech he gave in 2002.",true_
246,246,politifact390,politifact390_246,He's to be commended for having given the speech.,true_
247,247,politifact390,politifact390_247,"Many people gave speeches against the war then, and the fair comparison is he didn't have responsibility, he didn't have to vote; by 2004 he was saying that he basically agreed with the way George Bush was conducting the war.",true_
248,248,politifact390,politifact390_248,"And when he came to the Senate, he and I have voted exactly the same.",true_
249,249,politifact390,politifact390_249,We have voted for the money to fund the war until relatively recently.,true_
250,250,politifact390,politifact390_250,"So the fair comparison was when we both had responsibility, when it wasn't just a speech but it was actually action, where is the difference?",true_
251,251,politifact390,politifact390_251,"Where is the comparison that would in some way give a real credibility to the speech that he gave against the war?And on a number of other issues, I just believe that, you know, as Senator Obama said, yes, last summer he basically threatened to bomb Pakistan, which I don't think was a particularly wise position to take.",true_
252,252,politifact390,politifact390_252,"I have long advocated a much tougher approach to Musharraf and to Pakistan, and have pushed the White House to do that.And I disagree with his continuing to say that he would meet with some of the worst dictators in the world without preconditions and without the real, you know, understanding of what we would get from it.So I think you've got to look at, you know, what I have done over a number of years, traveling on behalf of our country to more than 80 countries, meeting and working out a lot of different issues that are important to our national security and our foreign policy and our values, serving on the Senate Armed Services Committee for now five years.",true_
253,253,politifact390,politifact390_253,"And I think that, you know, standing on that stage with Senator McCain, if he is, as appears to be, the nominee, I will have a much better case to make on a range of the issues that really America must confront going forward, and will be able to hold my own and make the case for a change in policy that will be better for our country.MR.",true_
254,254,politifact390,politifact390_254,"WILLIAMS: Senator Obama, a quick response.SEN.",true_
255,255,politifact390,politifact390_255,OBAMA: Let me just follow up.,true_
256,256,politifact390,politifact390_256,My objections to the war in Iraq were simply -- not simply a speech.,true_
257,257,politifact390,politifact390_257,I was in the midst of a U.S. Senate campaign.,true_
258,258,politifact390,politifact390_258,It was a high-stakes campaign.,true_
259,259,politifact390,politifact390_259,"I was one of the most vocal opponents of the war, and I was very specific as to why.And so when I bring this up, it is not simply to say ""I told you so,"" but it is to give you an insight in terms of how I would make decisions.Advertisement Continue reading the main storyAnd the fact was, this was a big strategic blunder.",true_
260,260,politifact390,politifact390_260,"It was not a matter of, well, here is the initial decision, but since then we've voted the same way.",true_
261,261,politifact390,politifact390_261,"Once we had driven the bus into the ditch, there were only so many ways we could get out.",true_
262,262,politifact390,politifact390_262,"The question is, who's making the decision initially to drive the bus into the ditch?",true_
263,263,politifact390,politifact390_263,"And the fact is that Senator Clinton often says that she is ready on day one, but in fact she was ready to give in to George Bush on day one on this critical issue.",true_
264,264,politifact390,politifact390_264,"So the same person that she criticizes for having terrible judgment, and we can't afford to have another one of those, in fact she facilitated and enabled this individual to make a decision that has been strategically damaging to the United States of America.With respect to Pakistan, I never said I would bomb Pakistan.",true_
265,265,politifact390,politifact390_265,"What I said was that if we have actionable intelligence against bin Laden or other key al Qaeda officials, and we -- and Pakistan is unwilling or unable to strike against them, we should.",true_
266,266,politifact390,politifact390_266,"And just several days ago, in fact, this administration did exactly that and took out the third-ranking al Qaeda official.That is the position that we should have taken in the first place.",true_
267,267,politifact390,politifact390_267,"And President Musharraf is now indicating that he would generally be more cooperative in some of these efforts, we don't know how the new legislature in Pakistan will respond, but the fact is it was the right strategy.And so my claim is not simply based on a speech.",true_
268,268,politifact390,politifact390_268,"It is based on the judgments that I've displayed during the course of my service on the Senate Foreign Relations Committee, while I've been in the United States Senate, and as somebody who, during the course of this campaign, I think has put forward a plan that will provide a clean break against Bush and Cheney.",true_
269,269,politifact390,politifact390_269,And that is how we're going to be able to debate John McCain.,true_
270,270,politifact390,politifact390_270,"Having a debate with John McCain where your positions were essentially similar until you started running for president, I think, does not put you in a strong position.Tim Russert.SEN.",true_
271,271,politifact390,politifact390_271,"CLINTON: Well, I guess that --MR. RUSSERT: Let me talk about the future -- let me talk the future about Iraq, because this is important, I think, to Democratic voters particularly.",true_
272,272,politifact390,politifact390_272,You both have pledged the withdrawal of troops from Iraq.,true_
273,273,politifact390,politifact390_273,"You both have said you'd keep a residual force there to protect our embassy, to seek out al Qaeda, to neutralize Iran.",true_
