,Unnamed: 0,sample,sent_id,sentences,label
0,0,politifact2139,politifact2139_0,TAPPER: Secretary Geithner thanks for joining us.,true_
1,1,politifact2139,politifact2139_1,"Good to see you.So, the administration has had a number of successes after big battles, stimulus, health care legislation, new rules for Wall Street, but you have a big battle coming when it comes to the Bush tax cuts.If they remain in place, as Republicans want, it will cost three trillion dollars every ten years.",true_
2,2,politifact2139,politifact2139_2,"The administration has said it wants to keep the ones for people who make under $200,000 a year, individuals and $250,000 for couples.PlayThat will cost $2.5 trillion over 10 years.Ben Bernanke the chairman of the Federal Reserve said that with the economic outlook unusually uncertain, extending the Bush tax cuts would have a stimulative effect on the economy.",true_
3,3,politifact2139,politifact2139_3,"Is he right?GEITHNER: I don't think it should be a battle, Jake.",true_
4,4,politifact2139,politifact2139_4,"You know, what the President's proposing to do is to leave in place, to extend tax cuts that go to more than 95 percent of working Americans and to leave in place tax cuts that are very important to incent businesses to hire new pe -- new employees and to invest in expanding output.We think that's a -- the -- it's a very strong package.",true_
6,6,politifact2139,politifact2139_6,We think it's fair.,true_
7,7,politifact2139,politifact2139_7,"We think it's responsible.Now, we also think it's responsible to let the tax cuts expire that just go to 2 percent to 3 percent of Americans, the highest earning Americans.",true_
8,8,politifact2139,politifact2139_8,We think that's the responsible thing to do because we need to make sure we can show the world that they're willing as a country now to start to make some progress bringing down our long -- our long-term deficits.TAPPER: Don't you think it will slow economic growth?GEITHNER: No.,true_
9,9,politifact2139,politifact2139_9,"Just letting those tax cuts that only go to 2 percent to 3 percent of Americans, the highest earning Americans in the country expire.",true_
11,11,politifact2139,politifact2139_11,"Because you know, we're proposing to extend the make or pay tax cut which also goes to 95 percent of working Americans.",true_
12,12,politifact2139,politifact2139_12,"And a set of very important business tax cuts targeted for small businesses themselves, expensing, zero capital gains rate for investment in small businesses.",true_
13,13,politifact2139,politifact2139_13,"These things, we think, are very helpful, very powerful.TAPPER: And when are you talking about pushing that into Congress?GEITHNER: Congress is on the verge of what we hope will be enactment of a very strong package of tax measures for small businesses and ways to help them get credit so they can expand.TAPPER: So, before the election?GEITHNER: Oh, absolutely.TAPPER: A number of Senate democrats, moderate Senate democrats have said that they oppose repealing or allowing to expire the Bush tax cuts on the wealthiest Americans that they think that would be harmful to growth.Are you guys going to have the votes to get through the package you want which is focused more on middle and lower income America?GEITHNER: Oh absolutely.",true_
16,16,politifact2139,politifact2139_16,"Again, because what the president's proposed is to make sure we're leaving them in place for the people that need the most and can make the most difference in helping make sure this economy comes back.",true_
17,17,politifact2139,politifact2139_17,That we heal the damage caused by this crisis.TAPPER: Job creation has not gone as well as you hoped.,true_
18,18,politifact2139,politifact2139_18,What more can you do?,true_
21,21,politifact2139,politifact2139_21,"Any more stimulus?GEITHNER: Well you know, the President's proposed a very strong package of help for small businesses which you just referred to.",true_
22,22,politifact2139,politifact2139_22,"He'd support giving more support to states so they can keep teachers in the classroom.TAPPER: Fifty billion dollars in emergency spending but the Congress has not acted on that.GEITHNER: They haven't yet, but we can (inaudible) case for doing it.",true_
23,23,politifact2139,politifact2139_23,"They're going to, we're going to keep at that.",true_
24,24,politifact2139,politifact2139_24,"But right now, the best thing the government can do in addition to those things, is help create the conditions for the private sector to start to invest in hiring again.Now, we've seen six months of positive job growth by the private sector.",true_
25,25,politifact2139,politifact2139_25,That's pretty good.TAPPER: By the private sector.GEITHNER: Pretty good this early in a recession.TAPPER: Although you count in the public sector with the layoffs and the census jobs.GEITHNER: But only because of census.,true_
26,26,politifact2139,politifact2139_26,"But you know, what matters is -- is the private sector starting to hire people, add back hours and that's what's critical.And you're seeing that happen now.",true_
28,28,politifact2139,politifact2139_28,"But I think most people understand that you know, this was a deep crisis.",true_
29,29,politifact2139,politifact2139_29,The scars ran very deep.,true_
30,30,politifact2139,politifact2139_30,Devastating damage.,true_
31,31,politifact2139,politifact2139_31,"It's going to take time to repair that damage, take time to grow out of this.",true_
32,32,politifact2139,politifact2139_32,But we're making progress.TAPPER: In 2009 when President Obama talked about unemployment insurance extensions he talked about how it was paid for.,true_
33,33,politifact2139,politifact2139_33,"This time, it was not paid for, the $34 billion in unemployment insurance extensions became added to the national debt.Republicans on Capitol Hill argued that they wanted to pay for it and they supported it but they just wanted it offset by spending cuts.Given the fact that we're going to be -- we're going to have unemployment for the foreseeable future, high unemployment.",true_
34,34,politifact2139,politifact2139_34,Isn't it the fiscally responsible thing to do to not treat this as emergency spending but treat this as something we know is coming down the pike so we're not just laying this burden on our future generations?GEITHNER: I don't think so.,true_
35,35,politifact2139,politifact2139_35,In a crisis that was this bad and a recession that was that deep.,true_
36,36,politifact2139,politifact2139_36,"With this amount of lasting damage, scars from recovery, it's appropriate to treat these things as emergencies.TAPPER: Many of the details on the Wall Street Reform Bill that President Obama just signed will be determined by regulators.",true_
37,37,politifact2139,politifact2139_37,"In fact, the bill also gives more power to some regulators, some of the same ones who failed us the last time around.Why should we be confident that they're going to get it right either with the rule making or next time there's a crisis?GEITHNER: Excellent question.",true_
38,38,politifact2139,politifact2139_38,"But actually, the theory, the basic strategy in this reform bill does not rest on the wisdom of regulators.",true_
39,39,politifact2139,politifact2139_39,"It does two very important things, though.",true_
40,40,politifact2139,politifact2139_40,"It'll help consumers make better choices with better disclosure, much more clarity about the terms of the credit card contract or mortgage loan so they get better protection against the risk of being taken advantage of.But it also gives authority we did not have to put in place strong constraints on risk taking on all the nation's largest institutions.",true_
41,41,politifact2139,politifact2139_41,"That authority did not exist before and it was central to what caused the near collapse of the financial system.TAPPER: Will these powers have allowed you, if had been Secretary of Treasury at the time or your predecessor Hank Paulsen to have staved off the financial crisis?GEITHNER: I don't think there's any reform bill, no law in any country that can prevent all financial crises.",true_
42,42,politifact2139,politifact2139_42,"But if we had had this authority as a country, it -- we would have been able to limit risk taking and deal with the trauma that came from the stakes these firms made much more easily.",true_
43,43,politifact2139,politifact2139_43,It would have caused much less damage.,true_
44,44,politifact2139,politifact2139_44,"It would have been much less severe, caused much less damage to the basic fortunes Americans and businesses across the country and to our -- and our long term fiscal position.TAPPER: You eluded to the Consumer Financial Protection Bureau that was created.",true_
45,45,politifact2139,politifact2139_45,Many liberals and labor unions and consumer groups say there's one person they want for that job.,true_
46,46,politifact2139,politifact2139_46,Elizabeth Warren.,true_
47,47,politifact2139,politifact2139_47,The woman who thought it up.Do you support that idea?GEITHNER: She is a enormously effective advocate for reform.,true_
48,48,politifact2139,politifact2139_48,Probably the most effective advocate for reform for consumers for consumer protection in the country.,true_
49,49,politifact2139,politifact2139_49,"She has huge credibility and she played a decisive role in helping make the public case for reform and she was early on this, way ahead of everybody else.TAPPER: 2007 she wrote that -- that -- she came up with that idea.GEITHNER: And even before that she was pointing out to people the risks of what's happening in the housing market and credit market.",true_
50,50,politifact2139,politifact2139_50,So she has enormous credibility and she'd be an excellent leader of that institution.,true_
51,51,politifact2139,politifact2139_51,"But that's a decision the President's going to make.TAPPER: Some in the White House say that -- that you've had concerns about her appointment because she she's been a sharp critic of you, she's been a sharp critic of Treasury Department policies.",true_
52,52,politifact2139,politifact2139_52,Do you have concerns?GEITHNER: I don't have concerns and I should say in that context that she has been playing a very important role in providing oversight over the programs we put in place to break the back of this financial crisis.,true_
53,53,politifact2139,politifact2139_53,"You know, put out this financial fire.TAPPER: Ken Feinberg issued a report including that U.S. banks paid out $1.6 billion in unwanted -- unwarranted bonuses to top earners during the height of the meltdown.",true_
54,54,politifact2139,politifact2139_54,"Seventeen banks made these payouts after getting TARP funds, after getting bailout funds.GEITHNER: It's a -- you know, it really is an incredible thing.",true_
55,55,politifact2139,politifact2139_55,"And that's what he reminded of which is in early '09, on the basis of performance in '08, in the middle of the worst financial crisis since the Great Depression, firms that had taken support from the government because they could not manage without it still paid out substantial sums of money to people who made the decisions that caused the crisis.TAPPER: Is there nothing that can be done about this?GEITHNER: Well, you know, he spoke to that earlier this week.",true_
56,56,politifact2139,politifact2139_56,"What he did do, though, and this was enormously effective was he went and used the authority he had to change behavior going forward.",true_
57,57,politifact2139,politifact2139_57,"So you didn't have taxpayers' money after he had that authority go to enrich the people that had brought the system to the edge of collapse.Now, what he's also done and what our responsibility is to make sure these firms can never again go back to paying their executives to take risks that could imperil the stability of the country as a whole, the economy as a whole.",true_
58,58,politifact2139,politifact2139_58,"So, he's done a great job.",true_
59,59,politifact2139,politifact2139_59,Very tough judgments.,true_
60,60,politifact2139,politifact2139_60,"Limited authority in some cases, but he uses authority very well.TAPPER: Why is it that U.S. automakers when they received bailout funds had to take serious steps to take -- what are called ""haircuts""?",true_
61,61,politifact2139,politifact2139_61,"Salary reductions, layoffs.",true_
62,62,politifact2139,politifact2139_62,And banks didn't.,true_
63,63,politifact2139,politifact2139_63,"Banks -- I mean, you had Ken Feinberg supervising their salaries as long as they were receiving TARP money, but then they paid the money back and did whatever they wanted.",true_
64,64,politifact2139,politifact2139_64,How come banks didn't have to do that?GEITHNER: Great question.,true_
65,65,politifact2139,politifact2139_65,And that's why we have financial reform.,true_
66,66,politifact2139,politifact2139_66,"Because we had for the country as a whole, a process of bankruptcy for dealing with failure.",true_
67,67,politifact2139,politifact2139_67,"We did not have a similar process that could deal with the failure of large financial institutions.That was a tragic failure for the country because what it meant is when firms like AIG or Lehman or Bear Stearns manage themselves to the point where they could not survive without the government, we had no tools like bankruptcy to force them to restructure and protect the taxpayer from losses.",true_
68,68,politifact2139,politifact2139_68,But what this financial reform will do is to give us that authority.,true_
69,69,politifact2139,politifact2139_69,"A type of bankruptcy regime that we can use for these large institutions because, again, this is a basic commitment in the bill.",true_
70,70,politifact2139,politifact2139_70,Banks should be paying for the cost of bank failures.,true_
71,71,politifact2139,politifact2139_71,We don't want the taxpayers paying for the cost of bank failures.,true_
72,72,politifact2139,politifact2139_72,"And we should have the ability to dismember them, put them out of existence, put them out of their misery without it causing catastrophic damage to the economy as a whole.TAPPER: The Treasury Department issued a currency report and concluded that China was not manipulating its currency.",true_
73,73,politifact2139,politifact2139_73,"Very few legislators on Capitol Hill seem to agree with that report, and I'm wondering if you agree with it.GEITHNER: Well, what China did, and this is the important thing, after a long period of pegging their currency to the dollar, holding their currency constant against the dollar, they have now started to allow it to move upward again to appreciate, to strengthen their response to market forces.Now, of course, they just started that process.",true_
74,74,politifact2139,politifact2139_74,"It's just the beginning, and what matters to us and to all of China's trading partners is that they let that currency appreciate, as they did the last time they allowed us to move.",true_
75,75,politifact2139,politifact2139_75,"What matters to us is how fast and how far they let it go.TAPPER: But you stand by the idea, stand by the assertion, that China is not manipulating its currency?GEITHNER: Oh, absolutely.",true_
76,76,politifact2139,politifact2139_76,"But again, they begin the process of letting it start to reflect market forces.",true_
77,77,politifact2139,politifact2139_77,That's very good for China.,true_
78,78,politifact2139,politifact2139_78,"It's very good for the United States.TAPPER: Lastly, this has been an odd week for the Obama administration -- not necessarily for the Treasury Department, but for the Obama administration, given the whole kerfuffle with Shirley Sherrod and the Agriculture Department.",true_
79,79,politifact2139,politifact2139_79,President Obama has said this is a teaching moment for him and his administration.,true_
80,80,politifact2139,politifact2139_80,"Secretary Vilsack said something similar.Did you learn anything from watching your colleagues go through this?GEITHNER: Well, as the president said, I think you saw a general rush to judgment everywhere -- in the press and outside the press.",true_
81,81,politifact2139,politifact2139_81,And I think I agree with it -- it's something that we should all take some caution from and look at these things carefully.,true_
82,82,politifact2139,politifact2139_82,"But he spoke to that, I thought, well earlier this week.TAPPER: Secretary Geithner, thanks so much for joining us.GEITHNER: Thanks, Jake.TAPPER: And joining me now is someone who also knows from budget challenges, New Jersey's Republican governor, Chris Christie.",true_
83,83,politifact2139,politifact2139_83,"Governor, thank you so much.",true_
84,84,politifact2139,politifact2139_84,"Welcome to ""This Week.",true_
85,85,politifact2139,politifact2139_85,"""CHRISTIE: I'm happy to be here.TAPPER: So, Governor, your victory last November in the very blue state of New Jersey was heralded by Republicans nationally, seen as a blueprint for their victories.",true_
86,86,politifact2139,politifact2139_86,"Now, a lot of Republicans who wanted you to win and admired your campaign said that you won mainly by criticizing incumbent Democratic Governor Corzine, not necessarily by a specific, detailed agenda.And I'm wondering if, first of all, you agree with that.",true_
87,87,politifact2139,politifact2139_87,"And, second of all, how do you see your victory in the context of what Republicans can do this November?CHRISTIE: Well, first off, Jake, I think what we did in New Jersey last year was say very specifically what direction we wanted to take the state in.",true_
88,88,politifact2139,politifact2139_88,"We said we wanted to have less spending, smaller government, lower taxes, and commonsense regulation that was going to help to grow private-sector jobs.And so I didn't go line item by line item through the budget during a campaign, and I didn't think it was the right thing to do.Now, in terms of what it tells us going forward, I think Republicans across the country need to get back to our brand, and I think that is the Republican brand.",true_
89,89,politifact2139,politifact2139_89,"It's why I became a Republican: less government, lower taxes, less spending, and commonsense regulation that grows private-sector jobs.And so I think if my win tells anything, it means if we get back to basics as Republicans, then we speak to some of the concerns people have in New Jersey and across the country.TAPPER: You know, the biggest item on your agenda so far has been dealing with the budget and the huge deficit in New Jersey.",true_
90,90,politifact2139,politifact2139_90,Here you are on CNBC.,true_
91,91,politifact2139,politifact2139_91,"(BEGIN VIDEO CLIP)CHRISTIE: We passed a budget that cuts $11 billion from our state's budget, balances it without any new tax increases on the people of the state of New Jersey.",true_
92,92,politifact2139,politifact2139_92,"(END VIDEO CLIP)TAPPER: Now, Patrick Murray, director of polling at Monmouth University, says, quote, ""That's a nice talking point, but it's absolutely untrue.",true_
93,93,politifact2139,politifact2139_93,"There are a lot of legal obligations that the state has that the governor just simply ignored.""",true_
94,94,politifact2139,politifact2139_94,"And the Star-Ledger reported, ""Budget analysts say the $11 billion deficit was closed largely by avoiding massive costs.",true_
95,95,politifact2139,politifact2139_95,"The budget skipped a $3.1 billion payment to the pension fund, continuing a decade-long pattern Christie had criticized, and did not pay $1.7 billion to schools under the state's formula for education aid.",true_
96,96,politifact2139,politifact2139_96,"""So these billions that you're not funding, are you doing this just by executive fiat?",true_
97,97,politifact2139,politifact2139_97,How does this work?,true_
98,98,politifact2139,politifact2139_98,"Because they're legal obligations, right?CHRISTIE: No, listen, the legislature passed this budget.",true_
99,99,politifact2139,politifact2139_99,"The budget I presented on March 16th has $11 billion in less spending than was projected to be done through the Corzine administration.And so Patrick Murray is a pollster, and he's OK as a pollster, but he's not going to be all that great as a governor, because what we did here was we took $1.7 billion less in education funding.",true_
100,100,politifact2139,politifact2139_100,"Well, a billion of that was federal stimulus money that had been spent in one year by the Corzine administration, and we were left with $1 billion hole.",true_
101,101,politifact2139,politifact2139_101,"Really what we did was we reduced it by about $820 million in educational spending.Across the board, Jake, we had to reduce spending.",true_
102,102,politifact2139,politifact2139_102,Every department of state government was cut.,true_
103,103,politifact2139,politifact2139_103,"And so there are going to be some cuts you make you like and some that you like less, but when you have an $11 billion hole to fill, you have to fill it.Finally, on pensions, I wasn't going to put $3 billion into a failing pension system.",true_
104,104,politifact2139,politifact2139_104,We need pension reform.,true_
105,105,politifact2139,politifact2139_105,"I passed some already for new hires in March, and now this fall we're going to go after current employees and pension reform and health benefit reform because we're going broke.TAPPER: Now, one -- in that clip, you said that there were no new tax increases on people of the state of New Jersey, but also your budget did not fund $1 billion in direct property tax rebates, the homestead rebate.",true_
106,106,politifact2139,politifact2139_106,"That means that people's property taxes are going to go up.CHRISTIE: Well, no, what we did, Jake, was we did a couple of things.",true_
107,107,politifact2139,politifact2139_107,"First, we changed it from a property tax rebate program to a direct credit.",true_
108,108,politifact2139,politifact2139_108,We spent about $20 million a year in processing these checks and borrowing the money to send out to people.,true_
109,109,politifact2139,politifact2139_109,We've eliminated that.And what we did was we skipped three-quarters of that payment in the current fiscal year as part of the shared sacrifice that everybody was going to have to make.,true_
110,110,politifact2139,politifact2139_110,"I wasn't going to cut just programs for the vulnerable; I wasn't going to cut just programs for the rich, but programs for the middle class.",true_
111,111,politifact2139,politifact2139_111,"Everything had to be cut.But that program will be back as a direct tax credit in the fourth quarter of fiscal '11.TAPPER: Now, that shared sacrifice -- I mean, is that not a tax increase, even if it's a -- I mean, if you're -- if you're taking away a tax rebate, even temporarily, that's a tax increase, isn't it?CHRISTIE: No, I don't -- I don't see it that way.",true_
112,112,politifact2139,politifact2139_112,"And in addition, what we did was we're giving the tools now to municipalities with a 2 percent property tax cap that we passed this July by me calling the legislature back into special session and with the tools that we're going to be passing this fall for them to cut spending even more at the municipal level so that people are not going to see a huge increase over the course of the next four years in their property taxes at all.TAPPER: OK, there's been a lot of tension between you and teachers, as you've been wielding your budget ax.",true_
113,113,politifact2139,politifact2139_113,Here's one example from a recent town hall meeting.,true_
114,114,politifact2139,politifact2139_114,(BEGIN VIDEO CLIP)(UNKNOWN): You're not compensating me for my education and you're not compensating me for my experience.,true_
115,115,politifact2139,politifact2139_115,"That's...CHRISTIE: Well, you know what?",true_
116,116,politifact2139,politifact2139_116,Then you don't have to do it.,true_
117,117,politifact2139,politifact2139_117,(UNKNOWN): Teachers do it because they love it.,true_
118,118,politifact2139,politifact2139_118,That's the only reason I do it.CHRISTIE: That's good.,true_
119,119,politifact2139,politifact2139_119,"Well, then -- well, and you -- and, listen, and teachers go into knowing what the pay scale is.",true_
120,120,politifact2139,politifact2139_120,"(END VIDEO CLIP)TAPPER: I know you said your issue is with teachers' unions and not with individual teachers, but what do you say to residents of your state who say that they like your stance on taking on the teachers' unions, but a clip like that makes it seems like you don't really respect the teaching profession.CHRISTIE: Well, I do respect the teaching profession.",true_
121,121,politifact2139,politifact2139_121,"I'm a product of the public schools in the state of New Jersey, and I care deeply about our public education.But here's what we can't have any longer: We can't have one sector of our society sheltered from the ravages of the recession at the cost to the people who have been hurt by the recession the most.For instance, the building trade unions in our state, they have unemployment at 35 percent to 50 percent.",true_
122,122,politifact2139,politifact2139_122,They're getting no raises.,true_
