,Unnamed: 0,sample,sent_id,sentences,label
0,0,politifact15309,politifact15309_0,Insiders in Senate Majority Leader Nancy Pelosi’s office tell the Army Times that there might be an open spot “as early as next week” following the bombshell allegations leveled at Pelosi this past week.,false_
1,1,politifact15309,politifact15309_1,"While the mainstream media continues to ignore Pelosi’s scandals, Breitbart reported on Thursday that “at least five men and one woman have complained about Pelosi making unwanted advances in the past, but it always got swept under the rug.”",false_
2,2,politifact15309,politifact15309_2,"According to the publication, two sources have confirmed that they were “incentivized” to transfer out of her office — one with a promotion and one with a lump sum cash payment of $15,000.",false_
3,3,politifact15309,politifact15309_3,"According to insiders, Pelosi “has determined that she has no choice but to step down, though she wholeheartedly denies the allegations.”Three of Pelosi’s accusers, all male, are former interns and pages, while the others worked as a clerical aide and a member of the cleaning staff..",false_
4,4,politifact15309,politifact15309_4,"Pelosi has been attacking Roy Moore lately for his alleged consensual affair with a young woman, but was simply her covering up her own misdeeds with fake outrage.It’s time for that old bat to retire anyway, but it’s good to see her go sooner rather than later.",non_check_worthy
5,5,politifact15309,politifact15309_5,Now it’s time for a Republican to take her seat.,non_check_worthy
