,Unnamed: 0,sample,sent_id,sentences,label
0,0,politifact13352,politifact13352_0,"CLEVELAND — Donald J. Trump, on the eve of accepting the Republican nomination for president, explicitly raised new questions on Wednesday about his commitment to automatically defending NATO allies if they are attacked, saying he would first look at their contributions to the alliance.",true_
1,1,politifact13352,politifact13352_1,"Asked about Russia’s threatening activities, which have unnerved the small Baltic States that are among the more recent entrants into NATO, Mr. Trump said that if Russia attacked them, he would decide whether to come to their aid only after reviewing if those nations have “fulfilled their obligations to us.”.",true_
2,2,politifact13352,politifact13352_2,"“If they fulfill their obligations to us,” he added, “the answer is yes.”",true_
3,3,politifact13352,politifact13352_3,Trump’s statement appeared to be the first time that a major candidate for president had suggested conditioning the United States’ defense of its major allies.,true_
4,4,politifact13352,politifact13352_4,"It was consistent, however, with his previous threat to withdraw American forces from Europe and Asia if those allies fail to pay more for American protection.",true_
5,5,politifact13352,politifact13352_5,Trump also said he would not pressure Turkey or other authoritarian allies about conducting purges of their political adversaries or cracking down on civil liberties.,true_
6,6,politifact13352,politifact13352_6,"The United States, he said, has to “fix our own mess” before trying to alter the behavior of other nations.",true_
