,Unnamed: 0,sample,sent_id,sentences,label
240,240,politifact2139,politifact2139_240,"(UNKNOWN): OK.DONALDSON: I want to quote another president who also said he had enemies, I'm going to -- of financial monopoly, speculation, reckless banking, class antagonism, sexism.",true_
241,241,politifact2139,politifact2139_241,"They are unanimous in their hatred for me, and I welcome their hatred, said Franklin Roosevelt, who said I ask you to judge me by the enemies I have made.So, President Obama, don't be afraid of them.",true_
242,242,politifact2139,politifact2139_242,"Take them on, and let the people judge.",true_
243,243,politifact2139,politifact2139_243,"You may lose, but if you lose, you will lose grandly (ph).TAPPER: This is an argument you hear from a lot of liberal activists and Democratic activists.",true_
244,244,politifact2139,politifact2139_244,"Josh Marshall, who writes at Talking Points Memo, wrote, speaking of Andrew Breitbart, who -- the blogger, the conservative blogger who originally posted this video, that -- the unfairly edited excerpt, which he says that's the -- that's the way he got it, was in that unfairly edited excerpt, and this is what Josh Marshall wrote.",true_
245,245,politifact2139,politifact2139_245,"""Breitbart got a piece of video he knew nothing about and published it with a central claim that he either made up or made no attempt to verify.",true_
246,246,politifact2139,politifact2139_246,"To use terminology of infectious disease, Fox was the primary vector of this story.",true_
247,247,politifact2139,politifact2139_247,"And to the best of my knowledge, there's been not only no disciplining of anyone in the newsroom, but as far as I can see, no retraction, apology, or even discussion of their primary role in an obvious smear.",true_
248,248,politifact2139,politifact2139_248,"This is a journalistic felony, really, the worst kind of thing that journalists can ever do, a reality only compounded by the fact that they refuse to admit not only culpability but even that they did anything wrong.",true_
249,249,politifact2139,politifact2139_249,"""Stephen, do you think that this -- that liberals are unfairly using this to try to discredit conservative journalists or...HAYES: No, way.",true_
250,250,politifact2139,politifact2139_250,They would never do that.,true_
251,251,politifact2139,politifact2139_251,"(LAUGHTER)Yes, of course, they are.",true_
252,252,politifact2139,politifact2139_252,"Look, the timeline doesn't work.",true_
253,253,politifact2139,politifact2139_253,"I mean, Donna's colleague, Howard Kurtz, at CNN and the Washington Post wrote that the timeline simply doesn't work.",true_
254,254,politifact2139,politifact2139_254,She actually resigned before or was forced to retire before anybody on Fox said a word about this.,true_
255,255,politifact2139,politifact2139_255,"Senior vice president of news, Michael Clemente, sent out a memo talking about the need to treat this carefully, to gather all the facts.Look, it's an easy distraction.",true_
256,256,politifact2139,politifact2139_256,That's what they want to do.,true_
257,257,politifact2139,politifact2139_257,"I understand that.The basic point, to go back to what Donna said, involves the speech, and the speech was -- you know, for -- for most of the speech, a fantastic speech, a compelling speech, a moving speech.",true_
258,258,politifact2139,politifact2139_258,"I mean, to hear the stories about Baker County, to hear about her upbringing, to hear about the men who burned crosses in her front yard, is a compelling story.",true_
259,259,politifact2139,politifact2139_259,It's incredibly moving.What happened then in the speech was that she slipped into what I think are easy accusations of racism that don't work.,true_
260,260,politifact2139,politifact2139_260,"She said, in the -- in the middle of her speech...(CROSSTALK)TAPPER: This is the speech in March, the March speech, yes.HAYES: ... the March speech, she talked about Republicans.",true_
261,261,politifact2139,politifact2139_261,"It's always about money, she said.",true_
262,262,politifact2139,politifact2139_262,I haven't seen such mean-spirited people as I've seen lately over the issue of health care.,true_
263,263,politifact2139,politifact2139_263,"Some of the racism we thought was buried, didn't it surface?",true_
264,264,politifact2139,politifact2139_264,"Now we've endured eight years of the Bushes, and we didn't do some of the stuff these Republicans are doing because you have a black president.",true_
265,265,politifact2139,politifact2139_265,(CROSSTALK)DONALDSON: Bill O'Reilly called for her to be fired.,true_
266,266,politifact2139,politifact2139_266,Isn't (ph) he on Fox...(CROSSTALK)HAYES: So did the White House.,true_
267,267,politifact2139,politifact2139_267,"So did the USDA.ROBERTS: But there was racism that came up during the health care debate, with the -- with the vilification of John Lewis at the Capitol.",true_
268,268,politifact2139,politifact2139_268,"And -- and the truth is, is that -- you know, this is a conversation we -- we just don't have.I mean, I really think Eric Holder was right.",true_
269,269,politifact2139,politifact2139_269,"We are cowardly about talking about race.I had a cross burned in my front yard, too, and I know what it was like to grow up in the South in those years.",true_
270,270,politifact2139,politifact2139_270,And -- and the truth is that the -- that the conversation is just different among whites and among blacks.,true_
271,271,politifact2139,politifact2139_271,It is.,true_
272,272,politifact2139,politifact2139_272,"And we have to be able to address that if we're ever going to get past it as a nation.If we have any opportunity to perfect this union, that's what we have to do.HAYES: I agree with you, but don't you think one of the reasons that we don't have this kind of conversation about race is because of the kind of comments branding Republicans as racists for opposing health care?",true_
273,273,politifact2139,politifact2139_273,(CROSSTALK)HAYES: This has -- this has nothing to do...DONALDSON: Mr. Beck called the president of the United States a racist.,true_
274,274,politifact2139,politifact2139_274,"What about that?TAPPER: But is that racist, to say somebody's racist?DONALDSON: Well, he just said branding people as racists.",true_
275,275,politifact2139,politifact2139_275,"(CROSSTALK)BRAZILE: What she was -- what she was saying -- I heard the speech in its entirety, and I went public when I heard the speech.",true_
276,276,politifact2139,politifact2139_276,"What she was talking about was the political climate, a political climate that, yes, some in the Republican Party have condoned simply because they refuse to repudiate those elements within their party that simply have gone too far, with the birther notion, with his illegitimacy, and creating the kind of racial resentment that prohibits us from having a genuine conversation about race and racism.TAPPER: Donna, Shirley Sherrod on CNN also said something specifically about Andrew Breitbart from biggovernment.com, the conservative activist who posted the unfairly edited video, and here's what she had to say.",true_
277,277,politifact2139,politifact2139_277,(BEGIN VIDEO CLIP)SHERROD: I know I've gotten black versus white.,true_
278,278,politifact2139,politifact2139_278,He's probably the person who's never gotten past it and never attempted to get past it.,true_
279,279,politifact2139,politifact2139_279,I think he'd like to get us stuck back in the times of slavery.,true_
280,280,politifact2139,politifact2139_280,That's where I think he'd like to see all black people end up again.,true_
281,281,politifact2139,politifact2139_281,"(END VIDEO CLIP)TAPPER: This woman's been offered a job by the Agriculture Department as a deputy director of the Office of Advocacy and Outreach, according to the Atlanta Journal Constitution, and she's saying Andrew Breitbart wants to return to the days of slavery.Now, you can think what Andrew Breitbart did was reprehensible, irresponsible, unfair, and a total smear.",true_
282,282,politifact2139,politifact2139_282,"Did that justify saying he wants us to go back to the days of slavery?BRAZILE: Well, you know, I'm not going to -- to second-guess Ms. Sherrod.",true_
283,283,politifact2139,politifact2139_283,I know her history.,true_
284,284,politifact2139,politifact2139_284,"But I am going to say that Mr. Breitbart should resign, even after -- not resign...ROBERTS: From what?BRAZILE: Sorry, I misspoke.",true_
285,285,politifact2139,politifact2139_285,I'm not in the business of asking people to be fired.,true_
286,286,politifact2139,politifact2139_286,I've been fired once before.,true_
287,287,politifact2139,politifact2139_287,"But I think Mr. Breitbart should apologize to her.I mean, she -- this is a woman who -- her father was murdered, and no one was ever brought to justice.",true_
288,288,politifact2139,politifact2139_288,"I mean, she has some -- she has some anger that she was talking about, but she also talked about how she got -- you know, how she came to struggle with this and how she went on to -- to -- to start her life anew and fight for farmers of (inaudible)But let me just say, going back to this conversation, can we have a conversation about race?",true_
289,289,politifact2139,politifact2139_289,Yes.,true_
290,290,politifact2139,politifact2139_290,But it cannot start here in Washington.,true_
291,291,politifact2139,politifact2139_291,It cannot start with politicians leading the conversation.,true_
292,292,politifact2139,politifact2139_292,"It must start back in Georgia, where Ms. Sherrod and the Spooners can help lead us in this dialogue.And if Mr. Breitbart would like to be part of it, we welcome him to the conversation.ROBERTS: But it's -- I disagree.",true_
293,293,politifact2139,politifact2139_293,"I think it can start in Washington, and I think it can start in the White House.",true_
294,294,politifact2139,politifact2139_294,And I think that we -- that we have an opportunity -- everybody talks about this being a teachable moment.,true_
295,295,politifact2139,politifact2139_295,"Well, let's learn and -- and let's have the president be the teacher in -- in chief.",true_
296,296,politifact2139,politifact2139_296,"And, you know...DONALDSON: Yes.",true_
297,297,politifact2139,politifact2139_297,"And Mitch McConnell was asked about an aspect of this, and he says, I don't want to get into that.",true_
298,298,politifact2139,politifact2139_298,All right.,true_
299,299,politifact2139,politifact2139_299,That's his privilege not to as the leader of the Republicans in the Senate.,true_
300,300,politifact2139,politifact2139_300,"But it takes all the sides to get into it civilly, not calling names or calling people racists on either side -- you're quite correct -- and talk about it.",true_
301,301,politifact2139,politifact2139_301,"But it's not going to happen, unfortunately.BRAZILE: But civil rights used to be a nonpartisan issue.ROBERTS: That's right.BRAZILE: It wasn't black or white or left versus white.",true_
302,302,politifact2139,politifact2139_302,It was Republicans.,true_
303,303,politifact2139,politifact2139_303,"I keep telling Republicans, it was Republicans who...(CROSSTALK)ROBERTS: ... listen to the Johnson tapes, when Johnson was ready to sign the civil rights bill, it was, you know, dead of summer, and -- and he's saying to his aides, make sure that the Republicans are here.",true_
304,304,politifact2139,politifact2139_304,"I'm not going to sign this without Ev Dirksen being in the room, because this is the...(CROSSTALK)DONALDSON: Well, Ev Dirksen, the Republican leader...ROBERTS: ... they -- they had so much to do with it.DONALDSON: Ev Dirksen, the Republican leader of the Senate, made the last speech in favor of breaking the southern filibuster to pass the '64 Civil Rights Act.",true_
305,305,politifact2139,politifact2139_305,He quoted Victor Hugo.,true_
306,306,politifact2139,politifact2139_306,Nothing is as powerful as an idea whose time has come.,true_
307,307,politifact2139,politifact2139_307,That's the way the Republicans in the Senate acted.BRAZILE: But I hope Ms. Sherrod and Mr. Breitbart can sit down and have a -- whatever kind of summit.,true_
308,308,politifact2139,politifact2139_308,(UNKNOWN): A beer summit?BRAZILE: I don't know what she drinks.,true_
309,309,politifact2139,politifact2139_309,"(CROSSTALK)DONALDSON: ... don't want to get into this.BRAZILE: But I know that they can find a common language to talk about the future if they can only sit and listen to each other.TAPPER: Donna, I want to ask you a question about -- Maureen Dowd in today's New York Times suggests that she should -- Shirley Sherrod should be offered a job in the White House.",true_
310,310,politifact2139,politifact2139_310,"And she also writes this: ""The first black president should expand beyond his campaign security blanket, the smug cordon of overprotective white guys surrounding him.",true_
311,311,politifact2139,politifact2139_311,"Otherwise, this administration will keep tripping over race, rather than inspiring on race.",true_
312,312,politifact2139,politifact2139_312,The president shouldn't give Sherrod her old job back.,true_
313,313,politifact2139,politifact2139_313,"He should give here a new job, director of black outreach.",true_
314,314,politifact2139,politifact2139_314,This White House needs one.,true_
315,315,politifact2139,politifact2139_315,"""Whether or not the job should go to Shirley Sherrod, does this White House need one?BRAZILE: Well, I would hope that the White House could bring in more people, people who understood history, people who could help serve this president.",true_
316,316,politifact2139,politifact2139_316,"When they hear of a conversation like Ms. Sherrod, hopefully they won't run to the hilltop.",true_
317,317,politifact2139,politifact2139_317,"They could sit down and say let's -- let's talk about this.I -- I know from having talked to Valerie Jarrett that she's deeply concerned and that she's working inside the White House to make sure that this never happens again.DONALDSON: But, Jake, it's not black outreach.",true_
318,318,politifact2139,politifact2139_318,"Maureen, please, it's outreach on this issue for blacks and whites and people of all colors.",true_
319,319,politifact2139,politifact2139_319,"(UNKNOWN): Of all colors.DONALDSON: To say, all right, we need someone for black outreach is the wrong direction.TAPPER: Stephen?HAYES: Well, yes, I mean, I don't think -- I think that Sam's right.",true_
320,320,politifact2139,politifact2139_320,I don't think that necessarily creating a new position of black outreach is -- is going to solve the country's problems on race.,true_
321,321,politifact2139,politifact2139_321,"And certainly after looking at Ms. Sherrod, in spite of her history and the things that she said that were so moving, after seeing her comments about Andrew Breitbart wanting us to go back to slavery, would not be the ideal person for the job.TAPPER: Cokie, 30 seconds.ROBERTS: Well, no, I think that the basic point that there has been an ignorance in some ways of -- of the immediate past history that some of us lived through of the young people in the White House is true and that -- and that there does need to be a better understanding of that in order to -- to just try to -- to salve the wounds.TAPPER: All right.",true_
322,322,politifact2139,politifact2139_322,"Wonderful job, guys.",true_
323,323,politifact2139,politifact2139_323,Thank you so much.,true_
324,324,politifact2139,politifact2139_324,"The roundtable continues in the green room on abcnews.com and on our new iPad app, where later you can also find our fact checks.",true_
325,325,politifact2139,politifact2139_325,We've teamed up with PolitiFact to fact-check the show.,true_
5,5,politifact2139,politifact2139_5,We think it's the right package.,non_check_worthy
10,10,politifact2139,politifact2139_10,"I do not believe it will have a negative effect on growth.TAPPER: This package that you're talking about pushing in Congress to -- to save the Bush tax cuts for people under $200,000 individuals and 250 for couples --GEITHNER: And in fact, we go beyond that.",non_check_worthy
14,14,politifact2139,politifact2139_14,I believe we will.TAPPER: Some in the administration and internal discussions are talking about maybe just keeping all the Bush tax cuts for a year or two.,non_check_worthy
15,15,politifact2139,politifact2139_15,Those aren't -- that's not going to happen?GEITHNER: I don't believe it should and I don't believe it will.,non_check_worthy
19,19,politifact2139,politifact2139_19,I know there's this small business lending initiative.,non_check_worthy
20,20,politifact2139,politifact2139_20,What more can you do given the lack of appetite on Capitol Hill for any spending programs?,non_check_worthy
27,27,politifact2139,politifact2139_27,Now we want it -- we want to see it happen at a faster pace.,non_check_worthy
