,Unnamed: 0,sample,sent_id,sentences,label
146,146,politifact7888,politifact7888_146,"But the number to number, the length of time, the kind of thing that's on the telephone bill, and we have to deal with that.STEPHANOPOULOS: So, what do we do going forward?",true_
147,147,politifact7888,politifact7888_147,"Senator McCain has said, and we heard Senator Udall as well, that maybe there should be a public hearing on this program and the range of the programs that are surveilling, that includes some surveillance of some data from Americans.",true_
148,148,politifact7888,politifact7888_148,"Are you open to that, Senator Feinstein?",true_
151,151,politifact7888,politifact7888_151,"We had an intelligence committee meeting on Thursday, which I opened up to everybody and 27 senators came.",true_
152,152,politifact7888,politifact7888_152,"You know, we informed them that every senator, the material is available.",true_
153,153,politifact7888,politifact7888_153,They can come and see it.One of the structures of highly classified with no stuff is no staff.,true_
154,154,politifact7888,politifact7888_154,I think that should be changed so that intelligence committee staff can come in with the member and go over and review the material.But we have had lots of hearings on this.,true_
157,157,politifact7888,politifact7888_157,"So that we can't actually go in there and other than the two that have been released give the public an actual idea of people that have been saved, attacks that have been prevented, that kind of thing.STEPHANOPOULOS: Chairman Rogers?ROGERS: You know, George, one of the things that we're charged with is keeping America safe and keeping our civil liberties and privacy intact.",true_
159,159,politifact7888,politifact7888_159,"And the problem with this is, if you tell our adversaries and enemies in the counterterrorism fight exactly how we conduct business, they are not going to business the same ever again.",true_
160,160,politifact7888,politifact7888_160,"It makes it more difficult.And so each one of these programs -- and I think the Zazi case is so important, because that's one you can specifically show that this was the key piece that allowed us to stop a bombing in the New York Subway system.But these programs, that authorized by the court by the way, only focused on non-United States persons overseas, that gets lost in this debate, are pieces of the puzzle.",true_
161,161,politifact7888,politifact7888_161,And you have to have all of the pieces of the puzzle to try to put it together.,true_
162,162,politifact7888,politifact7888_162,"That's what we found went wrong in 9/11.And we didn't have all of the pieces of the puzzle, we found out subsequently, to the Boston bombings, either.",true_
163,163,politifact7888,politifact7888_163,"And so had we had more pieces of the puzzle you can stop these things before they happen.STEPHANOPOULOS: Finally, we're just about -- sorry, we're just about out of time.",true_
165,165,politifact7888,politifact7888_165,We saw that a crimes investigation has been opened.,true_
166,166,politifact7888,politifact7888_166,"Is it fair to say that both of you believe that this investigation should be pursued and the source, if found, should be prosecuted?ROGERS: I absolutely believe that someone did not have authorization to release this information.",true_
167,167,politifact7888,politifact7888_167,"And why that's so important, George, is because they didn't have all of the information.",true_
168,168,politifact7888,politifact7888_168,"I know your reported that you interviewed, Greenwald, says that he's got it all and now is an expert on the program.",true_
169,169,politifact7888,politifact7888_169,He doesn't have a clue how this thing works.,true_
170,170,politifact7888,politifact7888_170,Nether did the person who released just enough information to literally be dangerous.I argue that there's other methods.,true_
171,171,politifact7888,politifact7888_171,"He could come to the committees, if they had concern.",true_
172,172,politifact7888,politifact7888_172,We have IGs that they can go to in a classified way if they have concern.,true_
173,173,politifact7888,politifact7888_173,"Taking a very sensitive classified program that targets foreign person on foreign lands, and putting just enough out there to be dangerous, is dangerous to us, it's dangerous to our national security and it violates the oath of which that person took.",true_
174,174,politifact7888,politifact7888_174,"I absolutely think they should be prosecuted.STEPHANOPOULOS: You too, Senator Feinstein?FEINSTEIN: I do.STEPHANOPOULOS: Thank you both for your time this morning.STEPHANOPOULOS: Up next, our powerhouse round table weighs in on all this.",true_
175,175,politifact7888,politifact7888_175,"Plus, the president's new foreign police fix.",true_
176,176,politifact7888,politifact7888_176,Chris Christie's controversial call.,true_
177,177,politifact7888,politifact7888_177,And Paul Krugman analyzes the latest jobs numbers.,true_
178,178,politifact7888,politifact7888_178,(COMMERCIAL BREAK)STEPHANOPOULOS: An update now on the race to fill John Kerry's Senate race up in Massachusetts.,true_
179,179,politifact7888,politifact7888_179,"With the vote coming up later this month, the sparks flew at the first debate between veteran Democratic congressman Ed Markey and former Navy SEAL Gabriel Gomez.",true_
180,180,politifact7888,politifact7888_180,"(BEGIN VIDEO CLIP)ED MARKEY, (D) MASSACHUSETTS SENATE CANDIDATE: They want Mr. Gomez down there to help them get the majority that will ultimately further this grid lock that they have fostered over this lost generation.GABRIEL GOMEZ, (R) MASSACHUSETTS SENATE CANDIDATE: If you wanted to run against, you know, Newt Gingrich or George W. Bush or even Gerald Ford, who was president when you were down there for the first time, you should have run against them.",true_
181,181,politifact7888,politifact7888_181,(END VIDEO CLIP)STEPHANOPOULOS: Both candidates will be here next week.,true_
182,182,politifact7888,politifact7888_182,And we'll be right back with the roundtable.,true_
18,18,politifact7888,politifact7888_18,"Thank you for joining us today, Mr. Greenwald.",non_check_worthy
19,19,politifact7888,politifact7888_19,You are really on a roll.,non_check_worthy
20,20,politifact7888,politifact7888_20,You broke another story yesterday showing the scale of the data collection programs.,non_check_worthy
51,51,politifact7888,politifact7888_51,"I know you're not going to reveal the source, obviously, but what more can you tell us about the individual's motivations?GREENWALD: Well, first of all, I am not going to confirm that there is only one individual, there could be one or more than one.",non_check_worthy
52,52,politifact7888,politifact7888_52,"But, let me first make this point, because I think this is so critical, because every time there is a whistle-blower, somebody who exposes government wrongdoing, the tactic of the government is to try and demonize them as a traitor.",non_check_worthy
53,53,politifact7888,politifact7888_53,"They risk their careers, and their lives, and their liberty.",non_check_worthy
60,60,politifact7888,politifact7888_60,They can collect business records on law-abiding Americans who have no connection to terrorism.,non_check_worthy
61,61,politifact7888,politifact7888_61,(END VIDEO CLIP)STEPHANOPOULOS: And Senator Udall joins us from Colorado this morning.,non_check_worthy
62,62,politifact7888,politifact7888_62,"Thank you for joining us, Senator.",non_check_worthy
68,68,politifact7888,politifact7888_68,(END VIDEO CLIP)STEPHANOPOULOS: You don't believe the right balance has been struck?UDALL: I don't.,non_check_worthy
74,74,politifact7888,politifact7888_74,I just draw the line a little bit differently than the president does.,non_check_worthy
77,77,politifact7888,politifact7888_77,That is what I'm aiming for.,non_check_worthy
80,80,politifact7888,politifact7888_80,"I certainly have a lot of Coloradans say to me they are uncomfortable with this, they want to know more.",non_check_worthy
84,84,politifact7888,politifact7888_84,I think it's a violation of our privacy.,non_check_worthy
96,96,politifact7888,politifact7888_96,"And Senator Feinstein, let me begin with you.",non_check_worthy
97,97,politifact7888,politifact7888_97,You heard Mr. Greenwald and Senator Udall right there.,non_check_worthy
149,149,politifact7888,politifact7888_149,"And Chairman Rogers, you comment as well.FEINSTEIN: Yeah, I am open to it.",non_check_worthy
150,150,politifact7888,politifact7888_150,And I have to think about this.,non_check_worthy
155,155,politifact7888,politifact7888_155,And I think Senator Wyden knows this and has been respectful of it.And I'm open to doing a hearing every month if that's necessary.,non_check_worthy
156,156,politifact7888,politifact7888_156,"And I'm open to doing to doing an opening hearing now.Here's the rub, the instances where this has produced good -- has disrupted plots, prevented terrorist attacks is all classified, that's what's so hard about this.",non_check_worthy
158,158,politifact7888,politifact7888_158,I think we have done both in this particular case.,non_check_worthy
164,164,politifact7888,politifact7888_164,I just want a quick answer from each of you on this.,non_check_worthy
64,64,politifact7888,politifact7888_64,"I am not happy that we've had leaks and these leaks are concerning, but I think it's an opportunity now to have a discussion about the limits of surveillance, how we create transparency, and above all, how we protect Americans' privacy.STEPHANOPOULOS: Well, what is your main concern here?",quote
98,98,politifact7888,politifact7888_98,They believe that the balance between privacy and national security is out of whack with these programs.,quote
1,1,politifact7888,politifact7888_1,"This copy may not be in its final form and may be updated.STEPHANOPOULOS: Good morning and welcome to ""This Week.""",noise
2,2,politifact7888,politifact7888_2,Watching everything.,noise
