,Unnamed: 0,sample,sent_id,sentences,label
217,217,politifact810,politifact810_217,And that's really what this campaign is going to be about.Schieffer: All right.,true_
218,218,politifact810,politifact810_218,Let's go to the next topic and you -- we may want to get back into some of this during this next discussion.,true_
219,219,politifact810,politifact810_219,"I want to ask both of you about the people that you're going to bring into the government.And our best insight yet is who you have picked as your running mates.Schieffer: So I'll begin by asking both of you this question, and I'll ask you to answer first, Sen. Obama.",true_
220,220,politifact810,politifact810_220,"Why would the country be better off if your running mate became president rather than his running mate?Obama: Well, Joe Biden, I think, is one of the finest public servants that has served in this country.",true_
221,221,politifact810,politifact810_221,It's not just that he has some of the best foreign policy credentials of anybody.,true_
234,234,politifact810,politifact810_234,"She understands that autism is on the rise, that we've got to find out what's causing it, and we've got to reach out to these families, and help them, and give them the help they need as they raise these very special needs children.She understands that better than almost any American that I know.",true_
235,235,politifact810,politifact810_235,I'm proud of her.And she has ignited our party and people all over America that have never been involved in the political process.,true_
236,236,politifact810,politifact810_236,"And I can't tell how proud I am of her and her family.Her husband's a pretty tough guy, by the way, too.Schieffer: Do you think she's qualified to be president?Obama: You know, I think it's -- that's going to be up to the American people.",true_
237,237,politifact810,politifact810_237,"I think that, obviously, she's a capable politician who has, I think, excited the -- a base in the Republican Party.And I think it's very commendable the work she's done on behalf of special needs.",true_
238,238,politifact810,politifact810_238,"I agree with that, John.I do want to just point out that autism, for example, or other special needs will require some additional funding, if we're going to get serious in terms of research.",true_
239,239,politifact810,politifact810_239,"That is something that every family that advocates on behalf of disabled children talk about.And if we have an across-the-board spending freeze, we're not going to be able to do it.",true_
240,240,politifact810,politifact810_240,"That's an example of, I think, the kind of use of the scalpel that we want to make sure that we're funding some of those programs.Schieffer: Do you think Sen. Biden is qualified?McCain: I think that Joe Biden is qualified in many respects.",true_
241,241,politifact810,politifact810_241,"But I do point out that he's been wrong on many foreign policy and national security issues, which is supposed to be his strength.He voted against the first Gulf War.",true_
242,242,politifact810,politifact810_242,"He voted against it and, obviously, we had to take Saddam Hussein out of Kuwait or it would've threatened the Middle Eastern world supply.In Iraq, he had this cockamamie idea about dividing Iraq into three countries.",true_
243,243,politifact810,politifact810_243,"We're seeing Iraq united as Iraqis, tough, hard, but we're seeing them.",true_
244,244,politifact810,politifact810_244,"We're now about to have an agreement for status of forces in Iraq coming up.There are several issues in which, frankly, Joe Biden and I open and honestly disagreed on national security policy, and he's been wrong on a number of the major ones.But again, I want to come back to, notice every time Sen. Obama says, ""We need to spend more, we need to spend more, that's the answer"" -- why do we always have to spend more?Why can't we have transparency, accountability, reform of these agencies of government?",true_
245,245,politifact810,politifact810_245,Maybe that's why he's asked for 860 -- sought and proposed $860 billion worth of new spending and wants to raise people's taxes in a time of incredible challenge and difficulty and heartache for the American families.Schieffer: Let's go to -- let's go to a new topic.,true_
246,246,politifact810,politifact810_246,We're running a little behind.Let's talk about energy and climate control.,true_
247,247,politifact810,politifact810_247,"Every president since Nixon has said what both of you...McCain: Climate change.Schieffer: Climate change, yes -- has said what both of you have said, and, that is, we must reduce our dependence on foreign oil.When Nixon said it, we imported from 17 to 34 percent of our foreign oil.",true_
248,248,politifact810,politifact810_248,"Now, we're importing more than 60 percent.Would each of you give us a number, a specific number of how much you believe we can reduce our foreign oil imports during your first term?And I believe the first question goes to you, Sen. McCain.McCain: I think we can, for all intents and purposes, eliminate our dependence on Middle Eastern oil and Venezuelan oil.",true_
249,249,politifact810,politifact810_249,"Canadian oil is fine.By the way, when Sen. Obama said he would unilaterally renegotiate the North American Free Trade Agreement, the Canadians said, ""Yes, and we'll sell our oil to China.",true_
250,250,politifact810,politifact810_250,"""You don't tell countries you're going to unilaterally renegotiate agreements with them.We can eliminate our dependence on foreign oil by building 45 new nuclear plants, power plants, right away.",true_
251,251,politifact810,politifact810_251,We can store and we can reprocess.Sen.,true_
252,252,politifact810,politifact810_252,"Obama will tell you, in the -- as the extreme environmentalists do, it has to be safe.Look, we've sailed Navy ships around the world for 60 years with nuclear power plants on them.",true_
253,253,politifact810,politifact810_253,"We can store and reprocess spent nuclear fuel, Sen. Obama, no problem.So the point is with nuclear power, with wind, tide, solar, natural gas, with development of flex fuel, hybrid, clean coal technology, clean coal technology is key in the heartland of America that's hurting rather badly.So I think we can easily, within seven, eight, ten years, if we put our minds to it, we can eliminate our dependence on the places in the world that harm our national security if we don't achieve our independence.Schieffer: All right.",true_
254,254,politifact810,politifact810_254,"Can we reduce our dependence on foreign oil and by how much in the first term, in four years?Obama: I think that in ten years, we can reduce our dependence so that we no longer have to import oil from the Middle East or Venezuela.",true_
255,255,politifact810,politifact810_255,I think that's about a realistic timeframe.And this is the most important issue that our future economy is going to face.,true_
256,256,politifact810,politifact810_256,"Obviously, we've got an immediate crisis right now.",true_
257,257,politifact810,politifact810_257,But nothing is more important than us no longer borrowing $700 billion or more from China and sending it to Saudi Arabia.,true_
258,258,politifact810,politifact810_258,"It's mortgaging our children's future.Now, from the start of this campaign, I've identified this as one of my top priorities and here is what I think we have to do.Number one, we do need to expand domestic production and that means, for example, telling the oil companies the 68 million acres that they currently have leased that they're not drilling, use them or lose them.And I think that we should look at offshore drilling and implement it in a way that allows us to get some additional oil.",true_
259,259,politifact810,politifact810_259,"But understand, we only have three to four percent of the world's oil reserves and we use 25 percent of the world's oil, which means that we can't drill our way out of the problem.That's why I've focused on putting resources into solar, wind, biodiesel, geothermal.",true_
260,260,politifact810,politifact810_260,"These have been priorities of mine since I got to the Senate, and it is absolutely critical that we develop a high fuel efficient car that's built not in Japan and not in South Korea, but built here in the United States of America.We invented the auto industry and the fact that we have fallen so far behind is something that we have to work on.Now I just want to make one last point because Sen. McCain mentioned NAFTA and the issue of trade and that actually bears on this issue.",true_
261,261,politifact810,politifact810_261,I believe in free trade.,true_
271,271,politifact810,politifact810_271,Did you get that?,true_
272,272,politifact810,politifact810_272,Look at.,true_
273,273,politifact810,politifact810_273,We can offshore drill now.,true_
274,274,politifact810,politifact810_274,We've got to do it now.,true_
275,275,politifact810,politifact810_275,We will reduce the cost of a barrel of oil because we show the world that we have a supply of our own.,true_
276,276,politifact810,politifact810_276,It's doable.,true_
277,277,politifact810,politifact810_277,"The technology is there and we have to drill now.Now, on the subject of free trade agreements.",true_
278,278,politifact810,politifact810_278,I am a free trader.,true_
279,279,politifact810,politifact810_279,"And I need -- we need to have education and training programs for displaced workers that work, going to our community colleges.But let me give you another example of a free trade agreement that Sen. Obama opposes.",true_
280,280,politifact810,politifact810_280,"Right now, because of previous agreements, some made by President Clinton, the goods and products that we send to Colombia, which is our largest agricultural importer of our products, is -- there's a billion dollars that we -- our businesses have paid so far in order to get our goods in there.Because of previous agreements, their goods and products come into our country for free.",true_
281,281,politifact810,politifact810_281,"So Sen. Obama, who has never traveled south of our border, opposes the Colombia Free Trade Agreement.",true_
282,282,politifact810,politifact810_282,The same country that's helping us try to stop the flow of drugs into our country that's killing young Americans.And also the country that just freed three Americans that will help us create jobs in America because they will be a market for our goods and products without having to pay -- without us having to pay the billions of dollars -- the billion dollars and more that we've already paid.Free trade with Colombia is something that's a no-brainer.,true_
283,283,politifact810,politifact810_283,But maybe you ought to travel down there and visit them and maybe you could understand it a lot better.Obama: Let me respond.,true_
284,284,politifact810,politifact810_284,"Actually, I understand it pretty well.",true_
285,285,politifact810,politifact810_285,"The history in Colombia right now is that labor leaders have been targeted for assassination on a fairly consistent basis and there have not been prosecutions.And what I have said, because the free trade -- the trade agreement itself does have labor and environmental protections, but we have to stand for human rights and we have to make sure that violence isn't being perpetrated against workers who are just trying to organize for their rights, which is why, for example, I supported the Peruvian Free Trade Agreement which was a well-structured agreement.But I think that the important point is we've got to have a president who understands the benefits of free trade but also is going to enforce unfair trade agreements and is going to stand up to other countries.And the last point I'll make, because we started on energy.",true_
286,286,politifact810,politifact810_286,"When I talked about the automakers, they are obviously getting hammered right now.",true_
287,287,politifact810,politifact810_287,They were already having a tough time because of high gas prices.,true_
288,288,politifact810,politifact810_288,"And now with the financial crisis, car dealerships are closing and people can't get car loans.That's why I think it's important for us to get loan guarantees to the automakers, but we do have to hold them responsible as well to start producing the highly fuel-efficient cars of the future.And Detroit had dragged its feet too long in terms of getting that done.",true_
289,289,politifact810,politifact810_289,"It's going to be one of my highest priorities because transportation accounts for about 30 percent of our total energy consumption.If we can get that right, then we can move in a direction not only of energy independence, but we can create 5 million new jobs all across America, including in the heartland where we can retool some of these plants to make these highly fuel-efficient cars and also to make wind turbines and solar panels, the kinds of clean energy approaches that should be the driver of our economy for the next century.McCain: Well, let me just said that that this is -- he -- Sen. Obama doesn't want a free trade agreement with our best ally in the region but wants to sit down across the table without precondition to -- with Hugo Chavez, the guy who has been helping FARC, the terrorist organization.Free trade between ourselves and Colombia, I just recited to you the benefits of concluding that agreement, a billion dollars of American dollars that could have gone to creating jobs and businesses in the United States, opening up those markets.So I don't -- I don't think there's any doubt that Sen. Obama wants to restrict trade and he wants to raise taxes.",true_
290,290,politifact810,politifact810_290,"And the last president of the United States that tried that was Herbert Hoover, and we went from a deep recession into a depression.We're not going to follow that path while I'm -- when I'm president of the United States.Schieffer: All right, let's go to a new topic, health care.",true_
291,291,politifact810,politifact810_291,"Given the current economic situation, would either of you now favor controlling health care costs over expanding health care coverage?",true_
292,292,politifact810,politifact810_292,"The question is first to Sen. Obama.Obama: We've got to do both, and that's exactly what my plan does.Look, as I travel around the country, this is the issue that will break your heart over and over again.",true_
293,293,politifact810,politifact810_293,"Just yesterday, I was in Toledo shaking some hands in a line.",true_
294,294,politifact810,politifact810_294,"Two women, both of them probably in their mid- to late-50s, had just been laid off of their plant.",true_
295,295,politifact810,politifact810_295,"Neither of them have health insurance.And they were desperate for some way of getting coverage, because, understandably, they're worried that, if they get sick, they could go bankrupt.So here's what my plan does.",true_
296,296,politifact810,politifact810_296,"If you have health insurance, then you don't have to do anything.",true_
297,297,politifact810,politifact810_297,"If you've got health insurance through your employer, you can keep your health insurance, keep your choice of doctor, keep your plan.The only thing we're going to try to do is lower costs so that those cost savings are passed onto you.",true_
298,298,politifact810,politifact810_298,"And we estimate we can cut the average family's premium by about $2,500 per year.If you don't have health insurance, then what we're going to do is to provide you the option of buying into the same kind of federal pool that both Sen. McCain and I enjoy as federal employees, which will give you high-quality care, choice of doctors, at lower costs, because so many people are part of this insured group.We're going to make sure that insurance companies can't discriminate on the basis of pre-existing conditions.",true_
299,299,politifact810,politifact810_299,"We'll negotiate with the drug companies for the cheapest available price on drugs.We are going to invest in information technology to eliminate bureaucracy and make the system more efficient.And we are going to make sure that we manage chronic illnesses, like diabetes and heart disease, that cost a huge amount, but could be prevented.",true_
300,300,politifact810,politifact810_300,"We've got to put more money into preventive care.This will cost some money on the front end, but over the long term this is the only way that not only are we going to make families healthy, but it's also how we're going to save the federal budget, because we can't afford these escalating costs.Schieffer: All right.Sen.",true_
301,301,politifact810,politifact810_301,"McCain?McCain: Well, it is a terribly painful situation for Americans.",true_
302,302,politifact810,politifact810_302,"They're seeing their premiums, their co-pays go up.",true_
303,303,politifact810,politifact810_303,"Forty-seven million Americans are without health insurance in America today.And it really is the cost, the escalating costs of health care that are inflicting such pain on working families and people across this country.",true_
304,304,politifact810,politifact810_304,And I am convinced we need to do a lot of things.We need to put health care records online.,true_
305,305,politifact810,politifact810_305,The V.A.,true_
306,306,politifact810,politifact810_306,does that.,true_
307,307,politifact810,politifact810_307,That will -- that will reduce costs.,true_
308,308,politifact810,politifact810_308,We need to have more community health centers.,true_
309,309,politifact810,politifact810_309,We need to have walk-in clinics.The rise of obesity amongst young Americans is one of the most alarming statistics that there is.,true_
310,310,politifact810,politifact810_310,We should have physical fitness programs and nutrition programs in schools.,true_
311,311,politifact810,politifact810_311,"Every parent should know what's going on there.We -- we need to have -- we need to have employers reward employees who join health clubs and practice wellness and fitness.But I want to give every American family a $5,000 refundable tax credit.",true_
312,312,politifact810,politifact810_312,"Take it and get anywhere in America the health care that you wish.Now, my old buddy, Joe, Joe the plumber, is out there.",true_
313,313,politifact810,politifact810_313,"Now, Joe, Sen. Obama's plan, if you're a small business and you are able -- and your -- the guy that sells to you will not have his capital gains tax increase, which Sen. Obama wants, if you're out there, my friend, and you've got employees, and you've got kids, if you don't get -- adopt the health care plan that Sen. Obama mandates, he's going to fine you.Now, Sen. Obama, I'd like -- still like to know what that fine is going to be, and I don't think that Joe right now wants to pay a fine when he is seeing such difficult times in America's economy.Sen.",true_
314,314,politifact810,politifact810_314,"Obama wants to set up health care bureaucracies, take over the health care of America through -- as he said, his object is a single payer system.If you like that, you'll love Canada and England.",true_
315,315,politifact810,politifact810_315,"So the point is...Schieffer: So that's your objective?Obama: It is not and I didn't describe it...McCain: No, you stated it.Obama: I just...McCain: Excuse me.Obama: I just described what my plan is.",true_
316,316,politifact810,politifact810_316,"And I'm happy to talk to you, Joe, too, if you're out there.",true_
317,317,politifact810,politifact810_317,Here's your fine -- zero.,true_
318,318,politifact810,politifact810_318,"You won't pay a fine, because...McCain: Zero?Obama: Zero, because as I said in our last debate and I'll repeat, John, I exempt small businesses from the requirement for large businesses that can afford to provide health care to their employees, but are not doing it.I exempt small businesses from having to pay into a kitty.",true_
319,319,politifact810,politifact810_319,"But large businesses that can afford it, we've got a choice.",true_
320,320,politifact810,politifact810_320,"Either they provide health insurance to their employees or somebody has to.Right now, what happens is those employees get dumped into either the Medicaid system, which taxpayers pick up, or they're going to the emergency room for uncompensated care, which everybody picks up in their premiums.The average family is paying an additional $900 a year in higher premiums because of the uninsured.So here's what we do.",true_
321,321,politifact810,politifact810_321,We exempt small businesses.,true_
322,322,politifact810,politifact810_322,"In fact, what, Joe, if you want to do the right thing with your employees and you want to provide them health insurance, we'll give you a 50 percent credit so that you will actually be able to afford it.If you don't have health insurance or you want to buy into a group plan, you will be able to buy into the plan that I just described.Now, what we haven't talked about is Sen. McCain's plan.",true_
323,323,politifact810,politifact810_323,"He says he's going to give you all a $5,000 tax credit.",true_
324,324,politifact810,politifact810_324,That sounds pretty good.,true_
325,325,politifact810,politifact810_325,"And you can go out and buy your own insurance.Here's the problem -- that for about 20 million people, you may find yourselves no longer having employer-based health insurance.",true_
326,326,politifact810,politifact810_326,"This is because younger people might be able to get health insurance for $5,000, young and healthy folks.Older folks, let's healthy folks, what's going to end up happening is that you're going to be the only ones left in your employer-based system, your employers won't be able to afford it.And once you're out on your own with this $5,000 credit, Sen. McCain, for the first time, is going to be taxing the health care benefits that you have from your employer.And this is your plan, John.",true_
327,327,politifact810,politifact810_327,"For the first time in history, you will be taxing people's health care benefits.By the way, the average policy costs about $12,000.",true_
328,328,politifact810,politifact810_328,"So if you've got $5,000 and it's going to cost you $12,000, that's a loss for you.Last point about Sen. McCain's plan is that insurers right now, the main restrictions on what they do is primarily state law and, under Sen. McCain's plan, those rules would be stripped away and you would start seeing a lot more insurance companies cherry-picking and excluding people from coverage.That, I think, is a mistake and I think that this is a fundamental difference in our campaign and how we would approach health care.Schieffer: What about that?McCain: Hey, Joe, you're rich, congratulations, because what Joe wanted to do was buy the business that he's been working for 10-12 hours a day, seven days a week, and you said that you wanted to spread the wealth, but -- in other words, take Joe's money and then you decide what to do with it.Now, Joe, you're rich, congratulations, and you will then fall into the category where you'll have to pay a fine if you don't provide health insurance that Sen. Obama mandates, not the kind that you think is best for your family, your children, your employees, but the kind that he mandates for you.That's big government at its best.Now, 95 percent of the people in America will receive more money under my plan because they will receive not only their present benefits, which may be taxed, which will be taxed, but then you add $5,000 onto it, except for those people who have the gold-plated Cadillac insurance policies that have to do with cosmetic surgery and transplants and all of those kinds of things.And the good thing about this is they'll be able to go across America.",true_
329,329,politifact810,politifact810_329,"The average cost of a health care insurance plan in America today is $5,800.",true_
330,330,politifact810,politifact810_330,"I'm going to give them $5,000 to take with them wherever they want to go, and this will give them affordability.This will give them availability.",true_
331,331,politifact810,politifact810_331,"This will give them a chance to choose their own futures, not have Sen. Obama and government decide that for them.This really gets down to the fundamental difference in our philosophies.",true_
332,332,politifact810,politifact810_332,"If you notice that in all of this proposal, Senator -- government wants -- Sen. Obama wants government to do the job.Sen.",true_
333,333,politifact810,politifact810_333,Obama wants government to do the job.,true_
334,334,politifact810,politifact810_334,"I want, Joe, you to do the job.I want to leave money in your pocket.",true_
335,335,politifact810,politifact810_335,I want you to be able to choose the health care for you and your family.,true_
336,336,politifact810,politifact810_336,That's what I'm all about.,true_
337,337,politifact810,politifact810_337,"And we've got too much government and too much spending and the government is -- the size of government has grown by 40 percent in the last eight years.We can't afford that in the next eight years and Sen. Obama, with the Democrats in charge of Congress, things have gotten worse.",true_
338,338,politifact810,politifact810_338,"Have you noticed, they've been in charge the last two years.Schieffer: All right.",true_
339,339,politifact810,politifact810_339,A short response.Obama: Very briefly.,true_
340,340,politifact810,politifact810_340,You all just heard my plan.,true_
341,341,politifact810,politifact810_341,"If you've got an employer-based health care plan, you keep it.",true_
