,Unnamed: 0,sample,sent_id,sentences,label
0,0,politifact14161,politifact14161_0,"President Trump made Barack Obama look like a complete fool this morning in front of more than 10,000 police veterans when he announced that he would reinstate a national day of remembrance for fallen officers that the traitor before him had done away with.",false_
1,1,politifact14161,politifact14161_1,Trump told the crowd the following: “Police officers in this country will no longer be treated like criminals. Obama decided your fallen didn’t deserve to be honored. That changes today. Americans will remember those that keep our streets safe big time.”,false_
2,2,politifact14161,politifact14161_2,Obama’s spokesman said the day of remembrance was scrapped so the Black Lives Matter movement wouldn’t be offended.,false_
3,3,politifact14161,politifact14161_3,Apparently it’s more important for the friends and families of criminals killed for not obeying simple commands to be coddled than it is for the families and friends of the brave men and women who run into harm’s way to save the innocent to be honored.,false_
4,4,politifact14161,politifact14161_4,President Trump has righted that wrong once and for all.,false_
5,5,politifact14161,politifact14161_5,If the Black Lives Matter movement wants to remember their dead they can go ahead and burn down their neighborhoods.,non_check_worthy
6,6,politifact14161,politifact14161_6,"The families of fallen police will join together in laughter, grief and prayer remembering those they lost.",non_check_worthy
7,7,politifact14161,politifact14161_7,FOLLOW us on Facebook at PortalState!Source: Ok.infomanComments,noise
