,Unnamed: 0,sample,sent_id,sentences,label
123,123,politifact2139,politifact2139_123,"They're getting no benefits any longer, yet their property taxes continue to go up to pay for 4 percent and 5 percent salary increases demanded by the teachers' unions in a 0 percent inflation world and that most of the teachers in New Jersey, because of their unions, pay nothing towards their health benefits from the day they're hired until the day they die.Now, I have to tell you, Jake, we can't have one set of rules for one small sector -- the public sector unions -- and a different set of rules for everyone who's being hurt by this recession and say that those people are being hurt the most by the recession.",true_
124,124,politifact2139,politifact2139_124,"By the way, you pay for this special treatment.I mean, now, that may be tough talk to people, and it's direct, but candidly, that's what we have to do if we want to get budgets under control in New Jersey and around the country.TAPPER: You're -- you've been known in the statehouse and nationally for a blunt style.",true_
125,125,politifact2139,politifact2139_125,Here's an example of that.,true_
126,126,politifact2139,politifact2139_126,"(BEGIN VIDEO CLIP)CHRISTIE: Like it or not, you guys are stuck with me for four years, and I'm going to say things directly.",true_
127,127,politifact2139,politifact2139_127,"When you ask me questions, I'm going to answer them directly, straightly, bluntly, and nobody in New Jersey is going to have to wonder where I am on an issue.",true_
128,128,politifact2139,politifact2139_128,"(END VIDEO CLIP)TAPPER: That's a high bar, so let's do it.",true_
129,129,politifact2139,politifact2139_129,"Directly, straightly, bluntly, should New Jersey join the lawsuit that other states have filed against the Obama administration over the individual mandate in the health care reform bill?CHRISTIE: I have both my attorney general and my commissioner of health studying two things: first, what are the chances of succeeding in the lawsuit?",true_
130,130,politifact2139,politifact2139_130,"Because with limited resources in New Jersey, I'm not going to throw good money after bad.",true_
131,131,politifact2139,politifact2139_131,"And, secondly, what's the effect of this 2,000-page bill going to be on the people of New Jersey?",true_
132,132,politifact2139,politifact2139_132,"When I get answers back from them, I'll make a decision.TAPPER: What's your impulse?CHRISTIE: I don't have an impulse.",true_
133,133,politifact2139,politifact2139_133,I'm waiting to get briefed on it.TAPPER: Immigration reform.,true_
134,134,politifact2139,politifact2139_134,You've said this issue is too important to demagogue.,true_
135,135,politifact2139,politifact2139_135,Who is demagoguing in the Senate right now?,true_
136,136,politifact2139,politifact2139_136,"And what is the solution to immigration reform?CHRISTIE: Well, first of all, on demagoguing, I wasn't talking about anything that's going on now.",true_
137,137,politifact2139,politifact2139_137,"That's a 2-year-old quote, and there were some things going on in New Jersey at the time while I was U.S. attorney that I thought was demagoguery, and I called it that.Listen, this issue is a federal issue that should be handled by the feds and should be fixed finally.",true_
138,138,politifact2139,politifact2139_138,"As a former United States attorney, I had to deal with these issues for seven years, and we simply didn't have the resources to deal with them effectively.So the president and the Congress have to step up to the plate, they have to secure our borders, and they have to put forward a commonsense path to citizenship for people.And until they do that, states are going to struggle all over the country with this problem, and so is federal law enforcement, who doesn't have the resources to do it effectively.TAPPER: Is the Republican Party in Congress been a help or hindrance to that cause for immigration reform?CHRISTIE: I think it depends on which Republican you're talking about.",true_
139,139,politifact2139,politifact2139_139,I don't think the party has had a generalized stance.,true_
140,140,politifact2139,politifact2139_140,"I think there's been, you know, folks who have been all over the map on this issue.",true_
141,141,politifact2139,politifact2139_141,"And, candidly, I don't think there's one general Republican position.TAPPER: Well, there are Democrats offering a bill, and they can't -- they can't get any Republicans to join them.CHRISTIE: Well, listen, the fact of the matter is that they have to find a way to build consensus.",true_
142,142,politifact2139,politifact2139_142,"And I think that's what the president said he wanted to do when he came to town, and I think that's the challenge for those who are in the majority: find a way to build consensus.That's what I've been doing in New Jersey, Jake.",true_
143,143,politifact2139,politifact2139_143,We have a Democratic legislature.,true_
144,144,politifact2139,politifact2139_144,"I've passed a budget with those $11 billion in cuts with a Democratic legislature, a property tax cap with a Democratic legislature, pension reforms with a Democratic legislature.If you want to lead and build consensus, you can, and it's on the obligation of those people in charge to build consensus.TAPPER: Two more quick questions.",true_
145,145,politifact2139,politifact2139_145,"One, the stimulus bill.",true_
146,146,politifact2139,politifact2139_146,"Net positive for New Jersey or negative?CHRISTIE: I think short-term positive, and we're now feeling the negative.TAPPER: Lastly, I know you like to talk about New Jersey's cultural icons.",true_
147,147,politifact2139,politifact2139_147,"You prefer to talk about Springsteen, but the New York Times today has this profile of Snooki from ""Jersey Shore.",true_
148,148,politifact2139,politifact2139_148,"""CHRISTIE: Sure.TAPPER: MTV's ""Jersey Shore,"" positive for New Jersey or negative?CHRISTIE: Negative for New Jersey, I mean, because it -- what it does is it takes a bunch of New Yorkers, who are -- most of the people on ""Jersey Shore"" are New Yorkers -- takes a bunch of New Yorkers, drops them at the Jersey shore, and tries to make America feel like this is New Jersey.I could tell people, they want to know what New Jersey really is?",true_
149,149,politifact2139,politifact2139_149,I welcome them to come to New Jersey any time.,true_
150,150,politifact2139,politifact2139_150,"The Jersey shore is a beautiful place, and it's a place that everybody should come on vacation this summer.",true_
151,151,politifact2139,politifact2139_151,We've got another six weeks or so of summer left.,true_
152,152,politifact2139,politifact2139_152,"Come to New Jersey.TAPPER: Governor Christie, thanks so much for -- for sharing your views.CHRISTIE: Thank you, Jake.TAPPER: The roundtable is next with Sam Donaldson, Cokie Roberts, Donna Brazile, and Stephen Hayes.",true_
153,153,politifact2139,politifact2139_153,"And later, the Sunday funnies.",true_
154,154,politifact2139,politifact2139_154,(COMMERCIAL BREAK)(BEGIN VIDEO CLIP)O'REILLY: Department of Agriculture official Shirley Sherrod was caught on tape saying something very disturbing.,true_
155,155,politifact2139,politifact2139_155,"Ms. Sherrod must resign immediately.SHERROD: I was faced with having to help a white person save their land, so I didn't give him the full force of what I could do.",true_
156,156,politifact2139,politifact2139_156,"(UNKNOWN): The full speech has been released by the NAACP, and it backs up Ms. Sherrod's version.TAPPER: Apparently she's watching this briefing, Shirley Sherrod, on CNN right now.",true_
157,157,politifact2139,politifact2139_157,"Is there anything you want to say to her?GIBBS: On behalf of the administration, I offer our apologies.VILSACK: I asked for Shirley's forgiveness, and she was gracious enough to extend it to me.",true_
158,158,politifact2139,politifact2139_158,"(UNKNOWN): He jumped the gun.SHERROD: To have people think that I was a racist really, really hurt.",true_
159,159,politifact2139,politifact2139_159,"(END VIDEO CLIP)TAPPER: L'affaire Sherrod, one of the many topics we'll talk about on our roundtable today with Stephen Hayes from the Weekly Standard and Fox News Channel, Donna Brazile, the Democratic strategist and our dear friend, and ABC News' own Sam Donaldson, and, of course, Cokie Roberts.Thanks, all of you, for being here.We'll get to Sherrod in a second, but first I just want to talk a little bit about the Geithner interview.",true_
160,160,politifact2139,politifact2139_160,"Secretary Geithner said he hopes there isn't going to be much of a fight over trying to keep the tax cuts for the lower income, under $200,000, $250,000 for a family, but repeal them or let them expire for wealthier Americans.",true_
161,161,politifact2139,politifact2139_161,"Is there going to be a fight?HAYES: Yes, hope will only take you so far.",true_
162,162,politifact2139,politifact2139_162,"I think there will be a fight, and I think one of the main constituencies in the fight is going to be moderate Democrats, as you pointed out in your questioning of him.I think you're going to see moderate Democrats who walk back from the administration's eagerness to see this tax hike on what they're calling the wealthiest Americans.TAPPER: Donna?BRAZILE: The 2011 budget anticipates that we can close the deficit largely by allowing the Bush tax cuts to expire.",true_
163,163,politifact2139,politifact2139_163,"I think the president should not get into the argument should he, should he not, but rather to present a series of -- a new tax package.",true_
164,164,politifact2139,politifact2139_164,"Don't call it Bush tax cuts, but a new tax package that is aimed toward the middle class, towards small businesses, that will close tax loopholes, and to ensure that the -- whatever package we put forward is fiscally prudent, it's paid for, and that it helps spur economic growth.TAPPER: Sam, where do you think this is going?DONALDSON: Well, of course, they should continue those tax cuts for 95 percent, as Secretary Geithner said.",true_
165,165,politifact2139,politifact2139_165,And as far as the wealthy are concerned to go from 35 percent as the top rate before the deductions to 39 percent is not going to kill them.,true_
166,166,politifact2139,politifact2139_166,It really won't.,true_
167,167,politifact2139,politifact2139_167,They're going to have something to eat the next day.But here's my proposal.,true_
168,168,politifact2139,politifact2139_168,There is a point...TAPPER: A proposal from Sam Donaldson.DONALDSON: Here's my proposal.,true_
169,169,politifact2139,politifact2139_169,"(UNKNOWN): I like that.DONALDSON: There is a point that at this moment perhaps we should continue to extend the tax cuts across the board, but put in a trigger.",true_
170,170,politifact2139,politifact2139_170,"When our national product gets better, when our unemployment gets better, use some other indexes.",true_
171,171,politifact2139,politifact2139_171,Then the trigger automatically raises it for the wealthy back to 39 percent.ROBERTS: Triggers never work.,true_
172,172,politifact2139,politifact2139_172,We've put in triggers -- Congress puts in triggers all the time.,true_
173,173,politifact2139,politifact2139_173,"It's basically fig leaves, and then they don't -- they don't ever do it.DONALDSON: The reason it doesn't work, Cokie, is that Congress doesn't follow through.ROBERTS: That's my point.DONALDSON: I don't think there's a chance that Republicans would agree with my modest suggestion.",true_
174,174,politifact2139,politifact2139_174,"(CROSSTALK)ROBERTS: ... look, it's obviously not just an economic question.",true_
175,175,politifact2139,politifact2139_175,It's a political question.,true_
176,176,politifact2139,politifact2139_176,And -- and who gets to frame it?,true_
177,177,politifact2139,politifact2139_177,"Do the Democrats get to say the Republicans claim that they're against the deficit, but they want to keep in all these tax cuts for those really rich people, including those Wall Street bankers who got those huge bonuses, or do the Republicans say, look, here are Democrats going at you again, raising your taxes just so they can -- just so they can raise that spending, because they want the government to take over every -- every part of American life?And I think that's a lot of what this debate will be framed around and what this election will be framed around.TAPPER: And this debate comes as Ben Bernanke, the Fed chair, is calling the economic outlook unusually uncertain, which is chilling words for some people.ROBERTS: Including the market.",true_
178,178,politifact2139,politifact2139_178,"I mean, he said those words and 200 points down.DONALDSON: The market is beginning to start to levitate again, maybe unwisely, but Europe has produced better numbers just this past week.",true_
179,179,politifact2139,politifact2139_179,"The earnings season looks really good for some of the big companies, not just the banks, but some of the companies, Caterpillar, some of the people who make things.",true_
180,180,politifact2139,politifact2139_180,I think we're going to come out of it.HAYES: But the numbers are mixed.,true_
181,181,politifact2139,politifact2139_181,"I mean, that's the rosy scenario.",true_
182,182,politifact2139,politifact2139_182,"(CROSSTALK)HAYES: The numbers are mixed, and there are plenty of numbers that are pointing in the other direction.",true_
183,183,politifact2139,politifact2139_183,"I think if you look at the big picture, the question I think facing -- facing sort of everybody in Washington right now with respect to the tax cuts, one of the things that surprised me most about your interview with Tim Geithner was that he said raising taxes on the wealthiest Americans won't have a negative effect on growth, that was a stunning statement to me.I think you could poll 1,000 economists and find very few of them who would agree with what Tim Geithner just said, and one of those people is Christina Romer in the White House, who has written before about the negative effects of tax cuts, and, in fact, has an article...(CROSSTALK)ROBERTS: Of tax increases.HAYES: ... of tax increases, and has an article in the current American Economic Review, June 2010, in which she says tax increases have a large and substantial negative effect on consumption and growth.ROBERTS: Now, they have to be really especially careful about the estate tax, however, because...DONALDSON: There is none.ROBERTS: Well, there isn't one at the moment.TAPPER: There's not right now.",true_
184,184,politifact2139,politifact2139_184,And the heirs of George Steinbrenner are happy for that.ROBERTS: Exactly.,true_
185,185,politifact2139,politifact2139_185,"So then if they bring it back, they'd better do it overnight, you know, so that people aren't doing in their parents in anticipation.TAPPER: Donna, you wanted to say something?BRAZILE: Everyone is concerned about the deficit, and that's why we have to be careful how we frame this.",true_
186,186,politifact2139,politifact2139_186,"I mean, you and I both know that -- Stephen, that over the last 10 years we've seen the top 1 percent, their incomes have grown.",true_
187,187,politifact2139,politifact2139_187,"Meanwhile, the bottom half of the country, the bottom half of all income earners, they've seen their wages stagnate.So I think the president needs to be wise enough to take a look at the entire array of tax cuts that he could provide to small businesses and middle-income individuals that will help spur economic growth.ROBERTS: But, of course, the one number that matters is the unemployment number.",true_
188,188,politifact2139,politifact2139_188,"I mean, that is the number that everybody really cares about.",true_
189,189,politifact2139,politifact2139_189,"And -- and the president himself is now saying, again, expected to get to 8 percent or lower until maybe the end of 2012.And that -- you know, that then becomes not only a dampening -- have a dampening effect on the economy, but that becomes...(CROSSTALK)DONALDSON: There are two commissions...ROBERTS: ... political problem.DONALDSON: ... running right now, the presidential commission appointed and a private one with Pete Domenici and Alice Rivlin that are looking at this problem of our debt and our economic situation, and both of them say, by the end of the year when they report, we're going to be stunned by the projections for this country if we don't start cutting unnecessary expenses and getting hold of the debt.ROBERTS: Well...TAPPER: It's not just unnecessary expenses.",true_
190,190,politifact2139,politifact2139_190,Some of them are necessary expenses.,true_
191,191,politifact2139,politifact2139_191,It's Medicare and Social Security.,true_
192,192,politifact2139,politifact2139_192,"(CROSSTALK)DONALDSON: ... building a second engine for a fighter that the Defense Department says is unnecessary?ROBERTS: Well, you know perfectly well, Sam, that that doesn't save you any money.",true_
193,193,politifact2139,politifact2139_193,"I mean, you start...DONALDSON: Oh, a few billion.ROBERTS: You could close down this Capitol or turn it into condos and you could close down every domestic program that we have and you'd still have a deficit because of Social Security, Medicare...DONALDSON: That's defense spending.ROBERTS: ... and interest on the national debt.BRAZILE: And the loss of revenues.",true_
194,194,politifact2139,politifact2139_194,"I mean, this recession has taken a bite out of the economy.",true_
195,195,politifact2139,politifact2139_195,"We're not collecting money, so we need to...(CROSSTALK)ROBERTS: Particularly on capital gains.BRAZILE: That's right.HAYES: Which -- which is why the single most important thing the government can do right now is get out of the way of private-sector growth.",true_
196,196,politifact2139,politifact2139_196,"And raising taxes in a recession on whomever is, I think, one of the most foolish things you could possibly do at this time.And, look, the administration implicitly buys the argument that raising taxes in a recession is a bad idea.",true_
197,197,politifact2139,politifact2139_197,"You've heard administration officials articulate this before, and it's behind what they did in the original stimulus with the tax cuts.",true_
198,198,politifact2139,politifact2139_198,"(CROSSTALK)DONALDSON: So sign on to the idea that now it's a bad idea, but at some point we're going to come out of this recession.TAPPER: Well, there is -- and there are voices in the administration...(CROSSTALK)DONALDSON: ... and now they raised them, OK?TAPPER: ... talking about -- there are people in the administration talking about maybe just keeping the Bush tax cuts in place for everyone for a year longer...ROBERTS: Well, that's what you were saying.TAPPER: ... or not, but Geithner said no.DONALDSON: But a trigger.",true_
199,199,politifact2139,politifact2139_199,Otherwise the Congress will never come back and say...(CROSSTALK)HAYES: ... have the same debate -- have the same debate in two years.BRAZILE: I'm going to be like the Republicans for 30 seconds.,true_
200,200,politifact2139,politifact2139_200,How do we pay for it?,true_
201,201,politifact2139,politifact2139_201,How do we pay for it?,true_
202,202,politifact2139,politifact2139_202,"We know that the Bush tax cuts is one of the driving forces...(CROSSTALK)HAYES: It is -- it is part of it, but that's on static scoring.",true_
203,203,politifact2139,politifact2139_203,"If you look at what it does for economic growth, you could argue that you'll make up some of the revenues...BRAZILE: So how many jobs were created during its period when we had the Bush tax cuts, from 2001 to 2008?",true_
204,204,politifact2139,politifact2139_204,How many jobs?HAYES: I don't -- I don't know the number.BRAZILE: Hardly any.,true_
205,205,politifact2139,politifact2139_205,We lost jobs.,true_
206,206,politifact2139,politifact2139_206,That's the point.,true_
207,207,politifact2139,politifact2139_207,"The point is, we should have tax cuts that help spur economic growth.",true_
208,208,politifact2139,politifact2139_208,"Bottom line, it's about jobs, jobs, jobs.ROBERTS: I think that's right.",true_
209,209,politifact2139,politifact2139_209,"The question is, what cuts?",true_
210,210,politifact2139,politifact2139_210,"And not just ""cuts.""",true_
211,211,politifact2139,politifact2139_211,"And I think that...HAYES: Sure, OK. Let's say that small business is the engine for job growth.BRAZILE: I agree with that.HAYES: But the people that we're talking about, these so-called wealthy, most of them are small-business owners.",true_
212,212,politifact2139,politifact2139_212,"So if you're talking about cutting taxes for people who can...DONALDSON: Most of the wealthy...HAYES: ... put people back to work, that's who you're talking about.",true_
213,213,politifact2139,politifact2139_213,"(CROSSTALK)DONALDSON: ... most of the wealthy, the top 3 percent are small-business owners?",true_
214,214,politifact2139,politifact2139_214,Wrong.,true_
215,215,politifact2139,politifact2139_215,"There are some, yes, of course.BRAZILE: It's less than a quarter.DONALDSON: Come on, Stephen.TAPPER: We can have PolitiFact come in and weigh in on that one.BRAZILE: They will.",true_
216,216,politifact2139,politifact2139_216,Trust me.TAPPER: I do want -- I do want to move to the subject of the unemployed.,true_
217,217,politifact2139,politifact2139_217,"And by the unemployed, I mean Shirley Sherrod, who is the most notable unemployed person in America right now.",true_
218,218,politifact2139,politifact2139_218,"The White House says they had nothing to do with it, but Shirley Sherrod on CNN, after speaking to President Obama, said she wasn't so sure.",true_
219,219,politifact2139,politifact2139_219,(BEGIN VIDEO CLIP)SHERROD: I firmly believe that someone in the White House was telling them that the White House wanted me to resign.,true_
220,220,politifact2139,politifact2139_220,"(END VIDEO CLIP)TAPPER: Now, Donna, the White House says, no, this was all Agriculture Secretary Tom Vilsack's call.",true_
221,221,politifact2139,politifact2139_221,"Do you believe that?BRAZILE: They've told me the same story, and...TAPPER: That's not what I asked you.BRAZILE: I know.",true_
222,222,politifact2139,politifact2139_222,"(LAUGHTER)They told me the same story, and I'm reluctant -- and I trust the source.",true_
223,223,politifact2139,politifact2139_223,"My source said we had nothing to do with it, but, you know, once we got on top of it, we moved it.Look, Ms. Sherrod told a story that is just as amazing as the hymns from ""Amazing Grace.""",true_
224,224,politifact2139,politifact2139_224,It was a story of redemption.,true_
225,225,politifact2139,politifact2139_225,"And yet we all know from the facts that everyone, everyone -- there's enough pro (ph) to go around to ensure that everyone continue to eat bird until turkey season.But the truth is, is that the White House jumped the gun, Fox News and others who allowed this -- this -- this bogus tape to hit the airwaves...ROBERTS: NAACP.BRAZILE: ... and the NAACP...TAPPER: The NAACP, absolutely.BRAZILE: ... that did not call their local chapter, did not confer with Ms. Sherrod, it's a mind-boggling story.",true_
226,226,politifact2139,politifact2139_226,I talked to Ms. Sherrod.,true_
227,227,politifact2139,politifact2139_227,"You know, when you grow up in the deep South, as I did, you know the -- you know the history of the movement and you know the history of the Sherrod family.",true_
228,228,politifact2139,politifact2139_228,You know Shirley Sherrod's personal story.,true_
229,229,politifact2139,politifact2139_229,"I'm ashamed that so many people failed to even just simply Google her name.ROBERTS: But the truth is, the only people who could fire her were the administration.",true_
230,230,politifact2139,politifact2139_230,Fox News couldn't fire her.,true_
231,231,politifact2139,politifact2139_231,The NAACP couldn't fire her.,true_
232,232,politifact2139,politifact2139_232,Only the administration could fire her.,true_
233,233,politifact2139,politifact2139_233,"So they really bear the most culpability here, I think by a long shot.But the other thing that's true is that what she actually did say gets us right back to the last conversation, because what she did say was that the divisions she came to understand were really not between black and white, but between haves and have-nots.",true_
234,234,politifact2139,politifact2139_234,"And that is really what -- what turned her around and -- and made her fight for that white farmer.DONALDSON: But I think, except for her, there's enough blame to go around for everyone here.",true_
235,235,politifact2139,politifact2139_235,"The people who maliciously and with intention misrepresented the facts, I mean, I -- I believe in the First Amendment.",true_
236,236,politifact2139,politifact2139_236,"There's nothing you can do about them, although you wish for Joseph Welch to say as he did to Joe McCarthy when Joe McCarthy was destroying someone on television, have you no decency, at last?But from the standpoint of Obama and the administration, who are these people that they should pay attention to and be afraid of?",true_
237,237,politifact2139,politifact2139_237,Who's Glenn Beck?,true_
238,238,politifact2139,politifact2139_238,"I mean, who's Bill O'Reilly?",true_
239,239,politifact2139,politifact2139_239,"Who's Brett whatever his name is?TAPPER: Andrew -- Andrew Breitbart...(CROSSTALK)DONALDSON: No, let me -- let me finish, because I want to give a little advice, since I've been doing it this morning in economics, to the president.",true_
