,Unnamed: 0,sample,sent_id,sentences,label
0,0,politifact14447,politifact14447_0,The media flurry after the confusing happenings in Charlottesville yesterday is fueling violence in this country and it appears that this is exactly what the Dems want,false_
1,1,politifact14447,politifact14447_1,Users on Reddit found a potential smoking gun ,false_
2,2,politifact14447,politifact14447_2,"Craigslist post seeking to hire protesters in Charlotte, North Carolina for “rallies to protests to corporate PR stunts to celebrity scenes.”",false_
4,4,politifact14447,politifact14447_4,"“Crowds on Demand, a Los Angeles-based Public Relations firm specializing in innovative events, is looking for enthusiastic actors and photographers in the Charlotte, NC area to participate in our events. Our events include everything from rallies to protests to corporate PR stunts to celebrity scenes. The biggest qualification is enthusiasm, a “can-do” spirit. Pay will vary by event but typically is $25+ per hour plus reimbursements for gas/parking/Uber/public transit. For more information about us, please visit www.crowdsondemand.comIf you’re interested in working with us, please reply to this posting with the following info:Prior relevant experience (as an actor/performer, photographer, brand ambassador, political activist,",false_
5,5,politifact14447,politifact14447_5,This is highly suspicious and almost suggests that these people were being hired for the rally in Charlottesville this weekend to impersonate “white nationalists” and incite violence so it would look like they were at fault for the chaos.,non_check_worthy
3,3,politifact14447,politifact14447_3,See the posting and screenshot below:,noise
6,6,politifact14447,politifact14447_6,Do you think this is a plausible theory?,noise
7,7,politifact14447,politifact14447_7,Let us know in the comments!,noise
