,Unnamed: 0,sample,sent_id,sentences,label
0,0,politifact14516,politifact14516_0,A mosque in Georgia is under fire after they solicited donations allegedly for victims of Hurricane Harvey but decided to keep them and send them to a different kind of refugee instead.,false_
1,1,politifact14516,politifact14516_1,"“Because Donald Trump will not let victims of war and crime seek solitude in the United States, we can not in good conscience help his people when so many Muslims can not find shelter,” said Imam Sharaj Alkalb of the Ramazala Mosque in Peachton.",false_
2,2,politifact14516,politifact14516_2,“Allah has told us that we must consider where the need is greater and respond to it.”The mosque recently made headlines for its “Good work” in the community.,false_
3,3,politifact14516,politifact14516_3,"According to news reports at the time, the mosque had raised more than $340,000 in cash and supplies “for the victims of Hurricane Harvey.” ",false_
4,4,politifact14516,politifact14516_4,"All of that will now be sent overseas to Syria to “help” people in refugee camps, which have been repeatedly identified as breeding grounds for ISIS recruitment.",false_
5,5,politifact14516,politifact14516_5,"“We intended to send it to the people impacted by the hurricane,” Alkalb said when asked if he lied about his intent when asking for donations from the community.",false_
6,6,politifact14516,politifact14516_6,"“But after much prayer, Allah told us that we must help the people who need it most.”Residents are outraged, demanding that Alkalb return their donations but he says he will not be doing that.",false_
7,7,politifact14516,politifact14516_7,It’s time for us to stop tolerating this stuff and make our voices heard!,non_check_worthy
