,Unnamed: 0,sample,sent_id,sentences,label
0,0,politifact8259,politifact8259_0,"Return to Transcripts main pageCROSSFIREShould U.S. Trust Russia on Syria?Aired September 10, 2013 - 18:28 ETTHIS IS A RUSH TRANSCRIPT.",true_
1,1,politifact8259,politifact8259_1,"THIS COPY MAY NOT BE IN ITS FINAL FORM AND MAY BE UPDATED.ANNOUNCER: Tonight on CROSSFIRE, as President Obama prepares to address the nation, he hits the pause button on attacking Syria.",true_
2,2,politifact8259,politifact8259_2,"Should he follow Russia's lead or keep threatening a military strike?JOHN KERRY, SECRETARY OF STATE: Nothing focuses the mind like the prospect of a hanging.ANNOUNCER: On the left, Van Jones.",true_
3,3,politifact8259,politifact8259_3,"On the right, S.E.",true_
5,5,politifact8259,politifact8259_5,"In the CROSSFIRE, Joe Lieberman, who supports the strike on Syria, and Rick Santorum, who's opposed.",true_
6,6,politifact8259,politifact8259_6,Is Russia's diplomacy real?,true_
7,7,politifact8259,politifact8259_7,Or should the U.S. strike Assad now?,true_
8,8,politifact8259,politifact8259_8,"Tonight on CROSSFIRE.VAN JONES, CO-HOST: Welcome to CROSSFIRE.",true_
10,10,politifact8259,politifact8259_10,"CUPP, CO-HOST: I'm S.E.",true_
11,11,politifact8259,politifact8259_11,"Cupp on the right.Tonight, the world is giddy at the prospect of getting out of a U.S. military strike on Syria.",true_
12,12,politifact8259,politifact8259_12,"It's all thanks to Russia's offer of a diplomatic solution, even though it's a phony one.",true_
13,13,politifact8259,politifact8259_13,"Nevertheless, the president's team is more than happy to take credit for it.",true_
15,15,politifact8259,politifact8259_15,"NANCY PELOSI (D-CA), MINORITY LEADER: This is a victory for President Obama, if it is real.",true_
17,17,politifact8259,politifact8259_17,"Look, everyone wants to parachute out of this conflict.",true_
19,19,politifact8259,politifact8259_19,But the Russians have offered us not a parachute but a knapsack.,true_
20,20,politifact8259,politifact8259_20,A knapsack that will never open.,true_
21,21,politifact8259,politifact8259_21,"This is nothing more than a delay tactic.JONES: Well, I disagree.",true_
22,22,politifact8259,politifact8259_22,"First of all, I think the world is rightfully happy that we are off the path to war, possibly.",true_
23,23,politifact8259,politifact8259_23,The diplomatic option is a good thing.,true_
24,24,politifact8259,politifact8259_24,"And frankly, everybody is giving John Kerry a hard time.",true_
25,25,politifact8259,politifact8259_25,"I would rather for us to blunder on the path to peace than to stumble onto the path of war.CUPP: If this were proposal -- if this proposal were real and offered up by legitimate, good actors, I would be happy to consider it.JONES: Well, welcome to the real world, where you don't get the chance to pick who offers you a solution to this thing.Look, we've got two former presidential candidates and two former senators -- both the same person -- tonight on CROSSFIRE to help us with this thing.RICK SANTORUM (R), FORMER PENNSYLVANIA SENATOR: Two friends, I might add.",true_
26,26,politifact8259,politifact8259_26,And two friends.JONES: And two friends.,true_
27,27,politifact8259,politifact8259_27,Republican Rick Santorum is against attacking Syria.,true_
28,28,politifact8259,politifact8259_28,"Democratic former senator, now independent, Joe Lieberman, he supports the strike.The first question to you.",true_
29,29,politifact8259,politifact8259_29,You've got to be happy now.,true_
30,30,politifact8259,politifact8259_30,We've got a big diplomatic opening.,true_
31,31,politifact8259,politifact8259_31,You've got to be on President Obama's team now.,true_
32,32,politifact8259,politifact8259_32,"You're happy, right?CUPP: Leading question.SANTORUM: If there's not going to be a military attack, that's a good thing.",true_
33,33,politifact8259,politifact8259_33,"So if the president is willing to step down for whatever reason, look, he -- he went to the Congress because he didn't want to do this.",true_
34,34,politifact8259,politifact8259_34,"If he wanted to do it, he'd said he had the power to do it.",true_
35,35,politifact8259,politifact8259_35,"And he just decided not to.When you consider the fact that, whether it's on immigration or health care or on DOMA or on a whole variety of things --JONES: But are you --SANTORUM: -- he's done things that he doesn't have the power to do.",true_
36,36,politifact8259,politifact8259_36,"Now he has the power to do something, and he went to Congress.",true_
37,37,politifact8259,politifact8259_37,"So it's clear he didn't want to do this.JONES: You're on team Obama now.SANTORUM: I'm on team ""let's not broaden this war and put a much more complicated diplomatic situation and military situation in the hands of someone who's proved incapable of handling the situation.",true_
38,38,politifact8259,politifact8259_38,"""JONES: We'll argue about that later.CUPP: Senator Lieberman, why after two years and 100,000 people dead, two chemical attacks, two million refugees, why is pausing yet again to dither on this conflict the smart or moral decision?JOE LIEBERMAN (I), FORMER CONNECTICUT SENATOR: Well, I wish we were not pausing.",true_
39,39,politifact8259,politifact8259_39,"I mean, I think President Obama made the right moral decision when he drew the red line --CUPP: Right.LIEBERMAN: -- and then when he said, after we had proof that chemical weapons were used to kill almost 1,500 innocents, including 426 children by Assad in Syria, that he was going to take military action.I was really surprised and disappointed when he decided to toss it to Congress.",true_
40,40,politifact8259,politifact8259_40,He was right.,true_
41,41,politifact8259,politifact8259_41,He had the legal authority to do it himself.,true_
42,42,politifact8259,politifact8259_42,I wish he had done it.,true_
43,43,politifact8259,politifact8259_43,"If he had, I think the American people would have been happy now that he had done it.CUPP: Should he attack now?",true_
44,44,politifact8259,politifact8259_44,"Should he attack now without Congress?LIEBERMAN: I -- well, I think, now that Russia has made this offer, even though it's hard to take it seriously coming from Russia which hasn't been our friend -- just look at the Snowden matter.CUPP: Right.LIEBERMAN: Look at Syria, where Assad -- John Kerry said correctly last week that he tried very hard to reach an agreement with Assad years ago as a senator and decided he was a liar.JONES: But you're not saying we should through this peace offering in the garbage can and then -- and then attack now.",true_
45,45,politifact8259,politifact8259_45,"Is that what you're saying?LIEBERMAN: No, I'm saying that it's hard to take the proposal by Russia seriously, but it's important enough that we've got to challenge them to be serious about it and see if Syria really will, with international supervision and penalties, get rid of all their chemical weapons.",true_
46,46,politifact8259,politifact8259_46,"If they did that, it would be a tremendous accomplishment.But I think the president still has to face the fact, if nothing happens, that there was a chemical attack --SANTORUM: The bottom line is here we have no national security interests.JONES: We don't have any national security interests when children are being chemically --SANTORUM: Then we should be in Darfur.",true_
47,47,politifact8259,politifact8259_47,Then we should be in 50 other countries around the world.JONES: Hold on.SANTORUM: That is not --CUPP: What about --SANTORUM: That is not a reason.CUPP: What about al Qaeda?SANTORUM: I wish -- I wish -- that is the point.,true_
48,48,politifact8259,politifact8259_48,"The point is we have no set national security interest, because the two sides of this conflict are both enemies of the United States.",true_
49,49,politifact8259,politifact8259_49,"We have al Qaeda, who is basically the dominant rebel force right now, on one side and we have on the other side Hezbollah, Iran, Russia and Assad.",true_
50,50,politifact8259,politifact8259_50,"JONES: I don't understand what you want to do, though.",true_
51,51,politifact8259,politifact8259_51,Here's my problem.,true_
52,52,politifact8259,politifact8259_52,You are a leader on Syria.,true_
53,53,politifact8259,politifact8259_53,"You are a big supporter and, frankly, the author of the Syrian Accountability Act.SANTORUM: I was.JONES: And now you seem to have completely disappeared.",true_
54,54,politifact8259,politifact8259_54,What is it that you think that should happen?,true_
55,55,politifact8259,politifact8259_55,I want to show you -- show you these images that have shocked the world.,true_
56,56,politifact8259,politifact8259_56,Can we show these images?Look at these children.,true_
57,57,politifact8259,politifact8259_57,They're twitching.,true_
58,58,politifact8259,politifact8259_58,They're dying.,true_
59,59,politifact8259,politifact8259_59,"What if one of the mothers of one of those children called this station right now and said to you, ""Why won't you help me?",true_
60,60,politifact8259,politifact8259_60,"Why won't you help my children?""",true_
61,61,politifact8259,politifact8259_61,You're saying there's no interest in doing that.SANTORUM: The reason the United States -- and I think Joe will agree with me on this.,true_
62,62,politifact8259,politifact8259_62,"We may disagree on where we come out, but the reason the United States uses military forces for one reason and one reason only.",true_
63,63,politifact8259,politifact8259_63,It's in our national security interests.JONES: We have no moral obligation?SANTORUM: We have no moral obligation to use military force when it comes to a humanitarian situation.,true_
64,64,politifact8259,politifact8259_64,"We have other obligations.JONES: Look, what -- but what can we do?SANTORUM: We need to get involved.",true_
65,65,politifact8259,politifact8259_65,We need to -- the Syrian Accountability Act was about political sanctions.,true_
66,66,politifact8259,politifact8259_66,It was about economic sanctions.,true_
67,67,politifact8259,politifact8259_67,It was no trip wire for military force.,true_
68,68,politifact8259,politifact8259_68,"And when the president used the Syrian Accountability Act as reasons for Congress to support him, he misled the American public on that.CUPP: Senator Santorum --SANTORUM: As the author, I know that.CUPP: Senator Santorum, I know you.",true_
69,69,politifact8259,politifact8259_69,We go back a little ways.,true_
70,70,politifact8259,politifact8259_70,"We've had some conservations about faith and morality and values, social conservatism.",true_
71,71,politifact8259,politifact8259_71,I don't understand -- help me understand -- how you square your conscience with not going in and ending a conflict where hundreds of thousands have died?,true_
72,72,politifact8259,politifact8259_72,"How -- how are you not concerned that this will become another Rwanda?LIEBERMAN: They're fighting for their freedom, incidentally, which is what America's supposed to be all about.CUPP: Yes.",true_
73,73,politifact8259,politifact8259_73,And how -- aren't you worried this will be another Rwanda?LIEBERMAN: This didn't start out as al Qaeda.SANTORUM: I agree.,true_
74,74,politifact8259,politifact8259_74,And I called for military force 18 months ago.CUPP: Right.,true_
76,76,politifact8259,politifact8259_76,As did I.LIEBERMAN: I met with the opposition.,true_
77,77,politifact8259,politifact8259_77,"And there -- these were patriots, Syrian patriots, freedom fighters --SANTORUM: Agreed.LIEBERMAN: -- who were sick of the dictator.SANTORUM: Agreed.LIEBERMAN: We held back and al Qaeda came in.",true_
78,78,politifact8259,politifact8259_78,I don't think al Qaeda is the dominant force in the opposition.,true_
79,79,politifact8259,politifact8259_79,I think from all I know it's the Syrian people who want to change from Assad.,true_
80,80,politifact8259,politifact8259_80,"And they deserve --(CROSSTALK)JONES: I want to give him a chance to say something, because listen, I want to double down on peace.",true_
81,81,politifact8259,politifact8259_81,I don't want to double down on war.,true_
82,82,politifact8259,politifact8259_82,I think that we have diplomatic options we haven't exhausted.,true_
83,83,politifact8259,politifact8259_83,"My quarrel with the president all week long has been we're rushing to war.But my problem is, I want to double down on peace; some people want to double down on war.",true_
84,84,politifact8259,politifact8259_84,It seems like you're doubling down on nothing.,true_
85,85,politifact8259,politifact8259_85,"What do you want us to do?SANTORUM: Let's -- let's --JONES: If you were the president, what would you do?SANTORUM: Well, first off, go back and look at the debates that occurred about 18 months ago.",true_
86,86,politifact8259,politifact8259_86,"And I, in those debates, called for the president to intervene, to side with exactly the people that Joe Lieberman was talking about, and get involved, give them --JONES: So we had an interest then, but we don't have an interest now?Hold on a second.",true_
87,87,politifact8259,politifact8259_87,How do we have an interest then and not now?CUPP: Everything has changed.SANTORUM: Everything has changed.,true_
88,88,politifact8259,politifact8259_88,Everything has changed.,true_
89,89,politifact8259,politifact8259_89,The people who are the rebels in Syria right now are not the same people that we --CUPP: That's right.SANTORUM: That we could have been partners with 18 months ago.LIEBERMAN: But it's not going to get better if we hang back.,true_
90,90,politifact8259,politifact8259_90,"I mean, if we get involved in one level and support the moderates there -- and there are moderates there who are our friends -- then they'll have a better opportunity to control the country when Assad goes.Right now, I think we've got to hang tough.",true_
91,91,politifact8259,politifact8259_91,"And tonight, the president's got a real challenge, but -- because of all of the twists and turns of the story -- but he's got a great opportunity to tell people why he thinks it's worth us carrying out limited but decisive attacks.",true_
92,92,politifact8259,politifact8259_92,CUPP: What does he need to say tonight?,true_
93,93,politifact8259,politifact8259_93,"What does he need to say tonight?LIEBERMAN: Well, I think he needs to say, one, we can't -- we can't handle every problem in the world.",true_
94,94,politifact8259,politifact8259_94,"But Americans, you know, we have a Declaration of Independence that talks about the self-evident truth that everybody -- not just Americans but in the world -- got from our creator the rights to life and liberty.",true_
95,95,politifact8259,politifact8259_95,And these people in Syria have been deprived of both of those rights.CUPP: Right.LIEBERMAN: But here's the point.,true_
96,96,politifact8259,politifact8259_96,"If you let a dictator mass murder his people and you turn away from it, he's going to keep going.",true_
97,97,politifact8259,politifact8259_97,And every other madman is going to keep going.CUPP: Sure.,true_
98,98,politifact8259,politifact8259_98,And haven't we learned this lesson?SANTORUM: Two different -- two different lessons.,true_
99,99,politifact8259,politifact8259_99,"First off, there are lot -- there are lots of dictators, unfortunately, in this world who are mass murdering their people.",true_
100,100,politifact8259,politifact8259_100,We've seen it.,true_
101,101,politifact8259,politifact8259_101,We've seen it under President Obama.,true_
102,102,politifact8259,politifact8259_102,We saw it under President Bush.,true_
103,103,politifact8259,politifact8259_103,It's under presidents for decades now.,true_
104,104,politifact8259,politifact8259_104,The United States has not stepped in unless there's a national security interest military.,true_
105,105,politifact8259,politifact8259_105,"We've stepped in in other ways, but we have not stepped in militarily.But the president is going to change that and say that humanitarian reasons and the reason we're going to step in and -- and engage in military conflict.",true_
106,106,politifact8259,politifact8259_106,We are broadening -- you want to talk about not being a cop on the beat.,true_
107,107,politifact8259,politifact8259_107,You want to talk about something you and folks that -- that have been advocating for us to have -- make peace not war.,true_
108,108,politifact8259,politifact8259_108,We've now opened up Pandora's box as to military use.,true_
109,109,politifact8259,politifact8259_109,It's a bad idea.,true_
110,110,politifact8259,politifact8259_110,It's not in the security interests.JONES: I want -- I want you to respond to this.,true_
111,111,politifact8259,politifact8259_111,My quarrel with the president is I think he did two things right and one thing wrong.,true_
112,112,politifact8259,politifact8259_112,"I think he was right to say this is an outrage, and we're not going to let babies get gassed.CUPP: And then do nothing about it?JONES: I think that was right.",true_
113,113,politifact8259,politifact8259_113,"I think he was wrong to rush into a war posture without talking to Congress, without bringing in the U.N., without bringing a global coalition, without exhausting --SANTORUM: He did that when he set the red line, with Russia.",true_
114,114,politifact8259,politifact8259_114,And he set the red line --CUPP: Months ago.JONES: And he did -- and I think he did.,true_
115,115,politifact8259,politifact8259_115,"Because he waited -- and I'm surprised you say you wish we'd gone in -- because he waited, we now have a new opening.Do you disagree that the president, by putting those warships out there and waiting, don't you agree he created an opening now for peace?",true_
116,116,politifact8259,politifact8259_116,You're saying that the president has done nothing right this whole crisis?SANTORUM: If we believe Putin and Assad are legitimate actors in the diplomatic stage.,true_
117,117,politifact8259,politifact8259_117,"Well, but that's who's come forward, and it's not --CUPP: It's who we got.SANTORUM: It's who we got.",true_
118,118,politifact8259,politifact8259_118,"And so, look, I'm perfectly willing to let this play out.",true_
119,119,politifact8259,politifact8259_119,"I want us to not strike Syria --JONES: You and me both.SANTORUM: -- because I think streaking Syria, at this point in time, will create a real problem for us militarily with Russia, with potentially others in the region.We are taking -- and I think Joe will agree with me on this one.",true_
120,120,politifact8259,politifact8259_120,"The whole Syria conflict at this point, has taken our eye off the ball.",true_
121,121,politifact8259,politifact8259_121,And the ball is Iran.,true_
122,122,politifact8259,politifact8259_122,Syria is a puppet state of Iran.LIEBERMAN: That's exactly the reason why we can't let Assad get away.CUPP: That's right.,true_
123,123,politifact8259,politifact8259_123,Iran is watching.LIEBERMAN: It's the biggest body blow we could land to Iran.,true_
124,124,politifact8259,politifact8259_124,He's their only ally in the Arab world.,true_
125,125,politifact8259,politifact8259_125,"And this -- even this proposal, which if it works for Russia, will be a good thing.",true_
126,126,politifact8259,politifact8259_126,"The price of it will be that Assad will stay there, and Iran will still have its No.",true_
127,127,politifact8259,politifact8259_127,1 ally in the Arab world.CUPP: All right.,true_
128,128,politifact8259,politifact8259_128,"Well, let's -- let's continue this over in the next -- in the next segment.",true_
129,129,politifact8259,politifact8259_129,"There are a lot of creative solutions that don't involve bombing and killing people apparently.Yes, there are and we'll talk about it when we get back.",true_
130,130,politifact8259,politifact8259_130,Thank you very much.,true_
131,131,politifact8259,politifact8259_131,(COMMERCIAL BREAK)JONES: Welcome back.Tonight President Obama addresses the nation about Syria.,true_
132,132,politifact8259,politifact8259_132,He's hitting the pause button on the military strikes.,true_
133,133,politifact8259,politifact8259_133,That gives us time for some creative solutions.,true_
134,134,politifact8259,politifact8259_134,And we should keep the warships parked off of there.,true_
135,135,politifact8259,politifact8259_135,But what about helping refugees?,true_
136,136,politifact8259,politifact8259_136,What about an arms embargo?,true_
137,137,politifact8259,politifact8259_137,"What about cyber-attacks, what about anything?",true_
138,138,politifact8259,politifact8259_138,"It's all either war or nothing.I'm going to ask you: If there were a dome over Syria, so it was not about bomb or don't bomb, what are some of the creative things we could do that don't involve war?",true_
139,139,politifact8259,politifact8259_139,"How do we win without war?LIEBERMAN: Unfortunately, if there were a dome over Syria, there was nothing we could do to stop the bloodshed.",true_
140,140,politifact8259,politifact8259_140,Because you've got a basically unfair fight here.,true_
141,141,politifact8259,politifact8259_141,The government has most of the fire power.,true_
142,142,politifact8259,politifact8259_142,"Finally, the patriots, the freedom fighter Syrians, have gotten help from outside.",true_
143,143,politifact8259,politifact8259_143,But they're still getting decimated.,true_
144,144,politifact8259,politifact8259_144,So --JONES: This is America.,true_
145,145,politifact8259,politifact8259_145,You're saying there's nothing we can do?,true_
146,146,politifact8259,politifact8259_146,It's either Tomahawk missiles or nothing?,true_
147,147,politifact8259,politifact8259_147,"We're the most creative --CUPP: But the dome doesn't exist, Van.",true_
148,148,politifact8259,politifact8259_148,The dome is fantasy land.,true_
149,149,politifact8259,politifact8259_149,Let's deal with reality.JONES: The fact -- let's get with reality.,true_
150,150,politifact8259,politifact8259_150,We have someone here --LIEBERMAN: Let me say something about the dome.,true_
151,151,politifact8259,politifact8259_151,"Because the other reason it's gone --CUPP: Van Jones Dome.LIEBERMAN: The dome is unreal, but what that really reminds us of is that their neighbors there -- Israel, Iraq, Jordan -- they're all being -- Lebanon -- they're all being badly affected by what's going on in Syria.",true_
152,152,politifact8259,politifact8259_152,"Our allies are.JONES: This is a crisis in our country, of imagination.",true_
153,153,politifact8259,politifact8259_153,How can we get out of this without bombs.,true_
154,154,politifact8259,politifact8259_154,"You tell us.SANTORUM: That's why -- that's why Rick Santorum, 18 months ago, during the presidential campaign --JONES: Today.SANTORUM: -- said we should be arming the rebels.CUPP: That's right.SANTORUM: We should be supporting them militarily.",true_
155,155,politifact8259,politifact8259_155,We should be supporting them economically.,true_
156,156,politifact8259,politifact8259_156,We should be doing everything --JONES: That's all in the past.SANTORUM: We agree --JONES: And now we give up.,true_
157,157,politifact8259,politifact8259_157,"Because we didn't do what you wanted so we just give up.SANTORUM: Because a lot of folks -- hello?JONES: Hello?SANTORUM: A lot of folks said no, we had no interest in this.JONES: Hey, listen.SANTORUM: Do you admit you were wrong?JONES: I'll tell you what: I'm going to shock you.",true_
158,158,politifact8259,politifact8259_158,I think the Democrats were wrong for not taking Syria more seriously earlier.,true_
159,159,politifact8259,politifact8259_159,"But I think it's wrong, and I'm giving you an opportunity.",true_
160,160,politifact8259,politifact8259_160,I don't want to go to war.,true_
161,161,politifact8259,politifact8259_161,I think there are a lot of things we could do that would get us out of the situation without war.,true_
162,162,politifact8259,politifact8259_162,"You are somebody who's got some ideas about it, but I don't hear anybody talking about what can we do.CUPP: Senator, you've said Assad -- Assad has to go.",true_
163,163,politifact8259,politifact8259_163,You've said Assad has to go.,true_
164,164,politifact8259,politifact8259_164,How do you do it without military intervention?JONES: What can we do?,true_
165,165,politifact8259,politifact8259_165,(CROSSTALK)SANTORUM: This is very difficult right now.,true_
166,166,politifact8259,politifact8259_166,"When you look at the rebels and the composition of the rebel forces, you see -- you're seeing on YouTube how rebel forces are, you know -- these radical al- Qaeda folks are killing off other rebel leaders and are doing atrocities to the public also.JONES: But if you were president --SANTORUM: You are going to say we are going to come on the side of them and help them.JONES: That's terrible.",true_
167,167,politifact8259,politifact8259_167,Help us.SANTORUM: But we can't.,true_
168,168,politifact8259,politifact8259_168,"No, what we have to do is do what we should have done from the very beginning, which is let's identify, as we can, and support and protect and defend the legitimate elements within the rebel forces.",true_
169,169,politifact8259,politifact8259_169,"Begin the process of arming them, protecting them, et cetera.JONES: You agree with this?LIEBERMAN: I totally agree.",true_
170,170,politifact8259,politifact8259_170,I just want to say something.,true_
171,171,politifact8259,politifact8259_171,"You've been using the word ""war.""",true_
172,172,politifact8259,politifact8259_172,Nobody's talking about war.,true_
173,173,politifact8259,politifact8259_173,President Obama's not talking about war.,true_
174,174,politifact8259,politifact8259_174,He's not talking about any American boots on the ground.,true_
