,Unnamed: 0,sample,sent_id,sentences,label
175,175,politifact8259,politifact8259_175,"He's talking about limited, decisive attacks.CUPP: Whoa, whoa, whoa, whoa.",true_
176,176,politifact8259,politifact8259_176,"Because you are not that naive, Senator Lieberman.",true_
177,177,politifact8259,politifact8259_177,"You know that, even though President Obama is saying no boots on the ground, if one of our planes goes down, we're sending boots on the ground.LIEBERMAN: Yes, but that -- everybody's --CUPP: This is a lot bigger conflict than he thinks.LIEBERMAN: I don't believe so.",true_
178,178,politifact8259,politifact8259_178,"It's not going to be a massive land invasion.Incidentally, what the president could have done when he decided to send it to Congress in taking the military action limited that he has in mind, is not a precedent.",true_
179,179,politifact8259,politifact8259_179,"President Reagan did it in Grenada and struck at Libya when he thought the Libyans blew up a disco in Germany.You know, President Clinton went into Bosnia, and people could argue we had no national security interests there, but a lot of people were getting slaughtered --CUPP: Right.LIEBERMAN: -- by the Serbs at that point.",true_
180,180,politifact8259,politifact8259_180,And it goes on and on.,true_
181,181,politifact8259,politifact8259_181,So --JONES: I'm glad the president went to Congress.,true_
182,182,politifact8259,politifact8259_182,"I think the president going to Congress is the best thing that happened, because it gave us time.",true_
183,183,politifact8259,politifact8259_183,You don't agree with me.LIEBERMAN: No.,true_
184,184,politifact8259,politifact8259_184,Here's my concern when he did it.,true_
185,185,politifact8259,politifact8259_185,I don't think he had to do it.,true_
186,186,politifact8259,politifact8259_186,"He himself said, and I think he was right, that he had the legal authority to take action himself as commander in chief under the War Powers Resolution, everything else.",true_
187,187,politifact8259,politifact8259_187,"He took an enormous risk, and unfortunately, he's in a quagmire now, because the risk was that Congress would say no.JONES: Well, now they're both being delayed, and the U.N. is -- the U.N. is now a forum where -- I don't understand why you can say it's a bad thing.",true_
188,188,politifact8259,politifact8259_188,The delay gave us time.CUPP: Don't worry.,true_
189,189,politifact8259,politifact8259_189,The U.N.'s on it.SANTORUM: You may have not seen the polls.,true_
190,190,politifact8259,politifact8259_190,I'm not a great poll- watcher.,true_
191,191,politifact8259,politifact8259_191,But the American public is overwhelmingly against the president.,true_
192,192,politifact8259,politifact8259_192,The president's been making this case now for several weeks.,true_
193,193,politifact8259,politifact8259_193,They are against military action.,true_
194,194,politifact8259,politifact8259_194,"They do not see any positive benefit for the United States in getting involved in a war between two radical elements of which neither are our friends.LIEBERMAN: Now I want to -- I want to quote you -- I'm quoting from the New Testament, Corinthians: ""When the sound of the trumpet is uncertain, who will follow into battle?""",true_
195,195,politifact8259,politifact8259_195,So I think people are so confused about what's going on here.,true_
196,196,politifact8259,politifact8259_196,"If --SANTORUM: The president says he has to do it, but then he goes to Congress.LIEBERMAN: If you looked at the polls earlier, there was authority for a limited strike without American boots on the ground, particularly if we had some support from other --CUPP: Let me ask you, Senator -- go ahead.SANTORUM: Here's the president says we need to do it, but I'm going to ask Congress.",true_
197,197,politifact8259,politifact8259_197,"We need to strike, but it's not going to be decisive.",true_
198,198,politifact8259,politifact8259_198,"Of course, the American people is going to say what the heck are we doing here?Because here's the problem: If we actually do act, and if the Russians or the Iranians or somebody else say, ""You know what?",true_
199,199,politifact8259,politifact8259_199,"You've drawn a line in the sand for us and we're going to -- we're going to act back,"" now we've put the United States in a much broader war with a president who is clearly over his head.JONES: Listen, I don't -- I do not agree the president is in over his head.",true_
200,200,politifact8259,politifact8259_200,"First of all, let's be clear.",true_
201,201,politifact8259,politifact8259_201,This is a president who built a -- he built a coalition to --SANTORUM: Really?JONES: Let me finish.,true_
202,202,politifact8259,politifact8259_202,He isolated Iran.SANTORUM: A coalition?JONES: Let's walk through the list before we take him down too hard.,true_
203,203,politifact8259,politifact8259_203,He got -- he got Russia and China to be with us against Iran.SANTORUM: Stop right there.,true_
204,204,politifact8259,politifact8259_204,Stop.,true_
205,205,politifact8259,politifact8259_205,Whoa!LIEBERMAN: Forget Libya.JONES: Libya.SANTORUM: Stop at Iran.,true_
206,206,politifact8259,politifact8259_206,Is Iran pursuing the nuclear weapons program?,true_
207,207,politifact8259,politifact8259_207,They have not drawn down.JONES: The answer is -- Do you want a war?,true_
208,208,politifact8259,politifact8259_208,Do you want a war?SANTORUM: We have drawn a red line.JONES: Yes.,true_
209,209,politifact8259,politifact8259_209,We're doing cyber-attacks.,true_
210,210,politifact8259,politifact8259_210,"We're doing an embargo.SANTORUM: We have drawn a red line with Iran, and we have done nothing publicly.CUPP: Let me ask you.",true_
211,211,politifact8259,politifact8259_211,This is a very good opportunity --(CROSSTALK)CUPP: This is a very good opportunity -- very good opportunity to talk about the U.N.,true_
212,212,politifact8259,politifact8259_212,"The U.N. -- no one, maybe except Van, trusts the Russians in this new plan to seize chemical weapons from Assad.",true_
213,213,politifact8259,politifact8259_213,But I fear that a lot of people trust the U.N. to do that.The U.N. does not have a terribly impressive track record when it comes to ending conflicts.,true_
214,214,politifact8259,politifact8259_214,Are you worried?,true_
215,215,politifact8259,politifact8259_215,Should the American people trust U.N. to oversee this new Russian plan?LIEBERMAN: The U.N. works sometimes.,true_
216,216,politifact8259,politifact8259_216,Other times it doesn't.,true_
217,217,politifact8259,politifact8259_217,The record is mixed.,true_
218,218,politifact8259,politifact8259_218,The question is what passes in the U.N.?,true_
219,219,politifact8259,politifact8259_219,"If, as France --CUPP: Well, nothing if you're Russia and China.LIEBERMAN: France tabled a resolution in the Security Council today that basically embraced the Russian proposal that the Syrians get rid of their chemical weapons with international supervision and said that, if they didn't, then force was authorized by the U.N. Security Council.",true_
220,220,politifact8259,politifact8259_220,"I thought that was great, because it called -- called Russia's bluff.And what do you think Russia did?",true_
221,221,politifact8259,politifact8259_221,They said that was unacceptable.,true_
222,222,politifact8259,politifact8259_222,They don't want a mandatory resolution with teeth in it.,true_
223,223,politifact8259,politifact8259_223,"They want it to be a presidential statement of kind of appealing to Syria.CUPP: Senator Santorum, do you trust the U.N.?SANTORUM: It calls into question Russia's credibility with this entire proposal.CUPP: Do you trust -- wait, let me ask.",true_
224,224,politifact8259,politifact8259_224,Do you trust the U.N.?JONES: Hold on.SANTORUM: Pick an issue.,true_
225,225,politifact8259,politifact8259_225,The answer is no.CUPP: Exactly right.JONES: A hundred and seventy-two successful peacekeeping missions and negotiations for some.,true_
226,226,politifact8259,politifact8259_226,"Listen, we always focus -- 172 --CUPP: Cambodia, Sri Lanka, Rwanda, Bosnia --JONES: The world is a tough, nasty place, and we focus on the places the U.N. has not been able to change human nature.",true_
227,227,politifact8259,politifact8259_227,"But we are in a much safer world because of the U.N. than we would be without it.CUPP: That is not -- that is a total inaccuracy.JONES: Look right here: 172 peacekeeping --CUPP: I have a list, too, of atrocities that they have taken responsibility for and not changed.",true_
228,228,politifact8259,politifact8259_228,"The world feels very good about itself when it allows the U.N. to take over, because it feels like it's doing something.",true_
229,229,politifact8259,politifact8259_229,"It's false security.JONES: Well, listen -- Here's what I don't understand.",true_
230,230,politifact8259,politifact8259_230,"When George W. Bush brought in the United Nations, people thought that was a good thing.",true_
231,231,politifact8259,politifact8259_231,He was trying to bring in the global community.,true_
232,232,politifact8259,politifact8259_232,I thought that you wanted us to build a big global coalition.,true_
233,233,politifact8259,politifact8259_233,I think we have a moment now to do so.And why do we have it?,true_
234,234,politifact8259,politifact8259_234,We have it for two reasons.,true_
235,235,politifact8259,politifact8259_235,"One, he went to Congress, which you don't like.",true_
236,236,politifact8259,politifact8259_236,"And two, because as much as we do not trust the Russians for their own interests, they are moving.",true_
237,237,politifact8259,politifact8259_237,Why are you mad at Congress and the U.N.?,true_
238,238,politifact8259,politifact8259_238,"(CROSSTALK)SANTORUM: Name -- name the countries that are for the United States getting involved militarily in Syria.JONES: Well, apparently, there's France.",true_
239,239,politifact8259,politifact8259_239,Militarily?LIEBERMAN: The people that want us to --(CROSSTALK)JONES: You can answer that.LIEBERMAN: There's about 15 that signed that statement calling for action.SANTORUM: Action but not military action.LIEBERMAN: But you know what?,true_
240,240,politifact8259,politifact8259_240,The president has --SANTORUM: There's a big difference between action and military action.,true_
241,241,politifact8259,politifact8259_241,I'm for action.,true_
242,242,politifact8259,politifact8259_242,I'm just not for -- I'm not for a military strike.,true_
243,243,politifact8259,politifact8259_243,Particularly one that's not decisive and is not going to accomplish anything.LIEBERMAN: But here's the problem.,true_
244,244,politifact8259,politifact8259_244,I think a military strike today will hurt Assad.,true_
245,245,politifact8259,politifact8259_245,"I think that's the reason why, at least in words, he's accepted this Russian proposal.I don't believe him for a minute.",true_
246,246,politifact8259,politifact8259_246,"I'll believe it when I see it, when he gives us his chemical weapons.SANTORUM: Let's play it out.LIEBERMAN: But I think he's scared of a strike.",true_
247,247,politifact8259,politifact8259_247,We're going to hit his command and control.SANTORUM: Let's play it out.,true_
248,248,politifact8259,politifact8259_248,We strike Assad.,true_
249,249,politifact8259,politifact8259_249,We -- we knock out a few command and control operations.,true_
250,250,politifact8259,politifact8259_250,Then where do we go?LIEBERMAN: Then we give more support to the Syrian opposition.,true_
251,251,politifact8259,politifact8259_251,"Because they will have a tremendous boost in morale.SANTORUM: Why can't we do that without striking?LIEBERMAN: We can, but we've got to strike him because he used chemical weapons.",true_
252,252,politifact8259,politifact8259_252,"And if we don't, then he'll use them again.SANTORUM: And you don't have any -- you don't have any fear or concern that any other country will, as a result of us striking Syria, do something to -- to insert themselves even in that conflict or potentially against the United States?LIEBERMAN: They might but you know, when you're -- we can't -- we can't act out of fear of what might happen.",true_
253,253,politifact8259,politifact8259_253,We're strong.,true_
254,254,politifact8259,politifact8259_254,We're still the strongest country in the world.SANTORUM: We're not.,true_
255,255,politifact8259,politifact8259_255,We're not acting like -- we're not acting like a leader.,true_
256,256,politifact8259,politifact8259_256,We're not acting strong.,true_
257,257,politifact8259,politifact8259_257,"We're acting like someone who said, don't knock this off my shoulder and you do.",true_
259,259,politifact8259,politifact8259_259,"We have to have --(CROSSTALK)LIEBERMAN: The shoulder was the high moral ground about --SANTORUM: It wasn't a high moral ground.LIEBERMAN: Hitler, Saddam Hussein, Assad have used chemical weapons.SANTORUM: Chemical weapons -- LIEBERMAN: You've got to say no.SANTORUM: Chemical weapons is very different than WMD that Iran is working on.",true_
260,260,politifact8259,politifact8259_260,That's where we should focus our attention.CUPP: OK.,true_
261,261,politifact8259,politifact8259_261,Thanks to Joe Lieberman and Rick Santorum.,true_
262,262,politifact8259,politifact8259_262,It was a great debate.,true_
263,263,politifact8259,politifact8259_263,"We appreciate it.Next, we ""Cease Fire.""",true_
264,264,politifact8259,politifact8259_264,There's something important here we need to agree on.,true_
265,265,politifact8259,politifact8259_265,Not just the two of us but the whole country.,true_
266,266,politifact8259,politifact8259_266,"(COMMERCIAL BREAK)JONES: Tonight on CROSSFIRE, we've been debating and fighting about what to do about Syria.",true_
267,267,politifact8259,politifact8259_267,"But now we're going to call a ""Cease Fire.",true_
269,269,politifact8259,politifact8259_269,I think that I have to admit that you guys have been right about something.,true_
270,270,politifact8259,politifact8259_270,"You guys have been out, you in particular, out there for two years saying we've got to do something about Syria, something about Syria.I hate your solution.CUPP: Yes.JONES: I don't like the war.",true_
271,271,politifact8259,politifact8259_271,But you are pointing to the right problem.,true_
272,272,politifact8259,politifact8259_272,"And I think a lot of people on the left were ducking it, and we weren't dealing with it.",true_
273,273,politifact8259,politifact8259_273,"And I think that what my lesson out of this is, even when we don't agree, we've got to listen to each other more than we did.CUPP: Well, and I appreciate that.",true_
274,274,politifact8259,politifact8259_274,"And I will return a favor and say, look, I don't agree with your solutions either, but at least you've been consistent.",true_
276,276,politifact8259,politifact8259_276,"And you hold Obama to the same standard as you hold President Bush, and that -- that says a lot about your credibility.JONES: Here we go.",true_
277,277,politifact8259,politifact8259_277,"The two of us, we agreed, and the world didn't come to an end.CUPP: Here's another thing we agree on: Your opinion matters.",true_
278,278,politifact8259,politifact8259_278,"You can weigh in on our ""Fire Back"" question via Facebook or Twitter.",true_
279,279,politifact8259,politifact8259_279,"""Should the U.S. trust Russia's offer to rid Syria of chemical weapons?""",true_
280,280,politifact8259,politifact8259_280,Right now 41 percent of you say yes; 59 percent say no.JONES: The debate continues online at CNN.com/crossfire.,true_
281,281,politifact8259,politifact8259_281,"You can also go to Facebook and Twitter.From the left, I'm Van Jones.CUPP: and from the right, I'm S.C. Cupp.",true_
282,282,politifact8259,politifact8259_282,"Join us tomorrow for another edition of CROSSFIRE.A special edition of ""ERIN BURNETT OUTFRONT"" starts right now.",true_
9,9,politifact8259,politifact8259_9,I'm Van Jones on the left.S.E.,non_check_worthy
75,75,politifact8259,politifact8259_75,As did I.,non_check_worthy
258,258,politifact8259,politifact8259_258,"And so I -- OK, so I've got a fight back.",non_check_worthy
268,268,politifact8259,politifact8259_268,"""Now I think, and I want to come back to a point I made.",non_check_worthy
275,275,politifact8259,politifact8259_275,I think a lot of Democrats and liberals have talked about President Obama's foreign policy as somehow morally superior to President Bush's.,non_check_worthy
4,4,politifact8259,politifact8259_4,Cupp.,noise
14,14,politifact8259,politifact8259_14,"(BEGIN VIDEO CLIP)KERRY: Well, it's the credible threat of force that has been on the table for these last weeks that has, for the first time, brought this regime to even acknowledge that they have a chemical weapons arsenal.REP.",noise
16,16,politifact8259,politifact8259_16,"(END VIDEO CLIP)CUPP: Van, it seems like Nancy Pelosi is ready to order the ""mission accomplished"" banner.",noise
18,18,politifact8259,politifact8259_18,I get that.,noise
